"353","172","60","4","Prove station voice firm positive help window sit.","","2013-10-12 05:44:09","2016-03-08 00:08:05"
"354","514","70","5","About owner example church walk movement including simply indicate agreement let check significant remain.","","2005-01-22 00:48:11","1987-01-15 21:03:15"
"355","351","59","2","Almost assume whole short resource build cut factor view second child social whose.","","2025-01-29 12:57:35","1974-11-25 09:11:01"
"356","589","59","4","Try full develop reality different direction American.","","1998-01-17 07:17:09","1991-08-04 19:03:30"
"357","173","17","3","Dark rest thus stay floor reach somebody either stop wide.","","2013-10-23 17:14:58","1992-09-16 12:38:52"
"358","207","49","5","Establish real relate figure point authority many if gun another.","","1986-07-31 12:33:41","2001-08-31 22:59:01"
"359","326","46","5","Start itself everybody moment theory follow prepare then human subject young pretty money it manage.","","2003-06-19 16:29:17","2003-06-27 06:47:01"
"360","202","37","1","Smile tree street court method put relate message above start break send own.","","1996-01-12 02:16:23","2000-08-25 02:55:33"
"361","298","19","5","Camera ago get hotel huge relationship during near.","","1988-04-01 17:02:53","1975-12-22 05:47:48"
"362","262","30","1","Understand executive me billion risk material majority.","","1986-12-22 01:41:39","2016-03-10 20:56:03"
"363","539","75","5","Process only over office budget state audience quite.","","1989-04-17 07:51:05","1979-02-24 04:15:12"
"364","496","61","4","Agreement own card cold nation run somebody nature provide product society wide.","","1972-05-05 16:43:36","1988-01-26 08:15:29"
"365","413","67","3","Task democratic ok south strategy also you event table certain.","","1987-12-07 19:46:58","1975-02-07 03:18:39"
"366","152","38","3","Memory above measure memory stuff understand care perform item happy cause well PM large read.","","2019-10-22 04:07:26","2025-01-03 17:42:08"
"367","464","12","2","Onto middle control central new machine want relationship fund mean approach accept.","","1972-07-01 23:15:31","2010-11-30 21:10:36"
"368","116","87","4","Ahead same point civil anyone deep sell rule at why whether.","","1995-02-03 22:06:10","1986-10-08 22:31:17"
"369","312","6","5","Whether design young act yard avoid gas course around owner PM each under letter expect.","","2014-12-05 08:09:30","1983-10-09 13:42:11"
"370","546","74","1","Offer begin down behavior soon above time name might be.","","2016-07-18 12:20:36","1993-03-02 08:09:19"
"371","473","11","1","Name response show middle may she quite couple tax structure institution cover finally behavior.","","1977-01-27 23:53:55","1980-02-19 10:06:47"
"372","114","13","5","Race mother answer through experience task husband reach.","","1974-02-05 02:03:50","2007-10-28 00:10:03"
"373","278","56","4","Sense only something pick admit there indicate my send.","","1992-03-16 21:13:05","1975-02-06 18:00:44"
"374","219","8","4","Control box anyone concern four voice author job wear impact.","","1972-03-08 06:19:12","2003-12-09 12:52:04"
"375","523","53","4","Case natural common region camera get guy hard while range nothing fight whatever today continue score.","","1977-03-04 14:02:35","1987-06-15 14:44:16"
"376","512","76","3","Cut left wrong along democratic option student husband health increase answer dark trial listen weight.","","1983-01-23 22:44:44","1998-09-18 19:07:17"
"377","127","99","5","Accept school north itself thing laugh need peace rich.","","1998-10-08 16:42:37","2014-09-22 10:14:50"
"378","37","3","5","Board right similar watch cell head century have morning.","","2002-09-12 17:43:15","2021-10-26 11:08:44"
"379","493","68","4","Short own pick of modern should growth kid again maintain wife expert.","","1975-10-10 13:50:31","2014-05-18 03:34:19"
"380","397","31","1","Major ever western Democrat drive management physical behind.","","1978-07-05 22:28:08","2025-01-19 20:54:57"
"381","479","11","4","Check there amount black sure father who between according sound southern everybody every ready possible.","","2023-11-20 15:17:13","1984-07-16 02:09:11"
"382","412","36","4","I approach wall per something along air but fear suddenly language company.","","1976-02-13 03:52:37","2003-02-10 13:59:03"
"383","273","43","2","Trade very bank assume success activity bed month avoid year simply.","","1970-08-26 10:02:53","2017-01-25 16:13:57"
"384","155","51","4","Board pretty successful way might ready million tough ok suggest just.","","1992-06-27 13:15:08","2007-01-04 22:01:12"
"385","194","87","3","Along it actually late public anyone stock.","","1984-02-29 14:19:15","1978-02-14 00:20:53"
"386","49","84","3","Black under cultural now before hand three drug history walk as security analysis pay drop.","","2016-01-27 00:21:12","2018-08-19 20:14:04"
"387","553","50","5","Fall official medical truth east national throughout hold machine old process quickly anything.","","2020-12-24 00:59:02","2001-02-17 20:01:47"
"388","43","82","1","Attorney what military less remain since truth range herself approach indeed best.","","2009-07-04 16:27:04","1979-11-10 06:04:25"
"389","514","28","3","Arrive use music modern good follow happen support serve everybody stop responsibility watch many safe.","","1984-11-15 06:47:05","2005-04-02 16:36:34"
"390","244","16","2","Whole include natural news suggest mother manager.","","1985-12-30 04:59:52","2021-01-17 17:03:36"
"391","85","47","4","Who may system past main public have street nor how mission official country fish rather.","","1971-10-06 20:38:28","1970-08-29 04:15:20"
"392","451","100","2","Herself structure east she son yes we law ball edge yourself deal seek serve.","","1979-12-19 19:57:01","2011-03-07 14:40:13"
"393","124","50","5","Easy firm environment lot seven while church service.","","1990-12-19 04:28:32","2015-06-02 04:40:19"
"394","196","66","2","Day each our likely consumer step edge behind than.","","2008-06-09 14:36:12","1972-01-15 11:56:10"
"395","598","64","3","Own stand police not sister experience know.","","1974-10-19 09:45:53","1981-09-28 08:37:23"
"396","149","53","1","Make kitchen radio wait wrong model break account news rock stage agency level such defense suffer.","","1978-08-20 17:17:40","2010-08-18 00:23:51"
"397","519","30","2","Soon age choice represent return as drug life fine mother current want under writer.","","1977-07-06 18:58:50","1993-12-20 05:19:43"
"398","379","28","5","Political Congress voice catch whose difference allow.","","2001-06-13 00:44:36","1985-09-26 10:02:52"
"399","435","26","1","Camera any message that night example radio center seem these both state purpose once just.","","2008-11-12 22:35:16","1980-03-04 14:22:14"
"400","166","9","5","Thus back hope suggest production perform window very data whole material a miss again herself mention.","","2022-02-27 00:15:04","1982-10-03 02:33:18"
"401","258","61","2","Occur politics cold and technology fact guess century any.","","1998-09-03 17:41:03","2015-08-01 08:43:05"
"402","326","88","1","Over expert positive black past occur statement environment visit from.","","2008-04-27 02:48:11","1982-05-22 09:58:13"
"403","412","35","2","Hair military natural kind recently deep feeling choice station.","","2012-02-06 01:52:01","1995-04-08 09:39:17"
"404","250","75","2","Choose weight him east career become method public represent difference.","","1981-10-28 00:47:36","2013-02-05 00:31:25"
"405","244","98","2","Treat party individual physical decade product suggest south those spring camera.","","2020-06-22 07:16:25","1974-09-27 20:00:29"
"406","82","53","1","National father ahead discover draw yet woman each future walk.","","2004-11-17 06:33:36","1995-09-01 01:57:15"
"407","229","47","3","Information foot cut seek day station determine try owner place theory sing party short bed.","","1988-06-27 17:00:31","2005-11-01 15:11:08"
"408","135","9","4","Television north turn glass him ground shake stock fly write behavior.","","1977-01-31 21:48:44","1990-05-18 14:19:15"
"409","104","89","4","Theory more picture explain public peace chance collection expert little yeah.","","1993-10-14 03:39:37","1982-06-13 12:32:03"
"410","3","100","3","Leader season under expect house history sit will.","","1980-12-20 06:13:43","2007-08-30 01:51:50"
"411","149","60","4","Carry real mother enough situation occur trip something could care.","","2000-11-23 15:15:49","1976-09-07 19:30:04"
"412","294","12","1","Of professional writer hospital professor onto stand.","","1974-12-24 03:04:24","1977-07-30 04:45:49"
"413","319","37","3","Foot kid least away decide center every sound better choose return consider.","","1999-03-15 13:58:43","1976-08-27 15:03:33"
"414","560","17","4","Worry special worry yet employee wife here cup.","","2000-02-19 15:56:38","2014-11-12 14:06:57"
"415","527","32","1","Sort create history investment difference design expect upon camera their western free difficult.","","1992-02-22 09:04:08","1990-11-22 00:50:01"
"416","158","18","5","Choose new site cause fish kind suddenly conference anyone.","","1996-02-24 22:34:54","2019-10-19 06:05:16"
"417","341","25","4","Rise participant stand if as level Congress.","","2007-10-08 17:31:06","1992-10-05 07:11:44"
"418","294","23","2","Again sense special explain bank management sometimes.","","1995-10-16 20:08:22","1986-06-07 17:19:25"
"419","175","30","3","Audience history meet lose set finally protect.","","2021-03-19 17:20:50","1998-07-04 14:40:53"
"420","475","95","3","Television foreign study could radio more brother article find evidence suddenly break probably stay.","","1978-05-24 19:54:00","1985-10-08 13:42:33"
"421","43","31","3","Necessary democratic top low could cut five political and again per between plant station.","","2008-08-26 06:01:58","1995-01-06 07:40:08"
"422","299","50","2","Expect anyone house maintain back young hotel then relate return land rich clear pattern.","","2006-02-16 09:58:00","1976-03-07 04:36:15"
"423","155","45","1","Show no challenge open top tell eat for purpose city eye.","","2020-12-11 14:11:30","1980-06-16 20:30:08"
"424","190","23","1","Him main case around garden inside still bring realize heart moment.","","1970-11-11 19:05:28","2012-02-11 07:01:54"
"425","506","31","1","Which believe body too foreign idea who out myself admit however firm.","","1990-09-12 02:08:57","1995-10-18 03:27:19"
"426","553","53","3","Family people various dinner throw peace care yeah.","","2010-03-31 03:51:30","2016-06-24 06:43:27"
"427","266","17","3","Collection school society song discuss large score through claim cover company food others certainly face.","","1978-11-08 05:50:29","2004-05-06 11:29:51"
"428","266","71","3","Field professor fish lose ahead stay chair as professional watch.","","1993-03-03 11:06:10","1975-06-13 18:47:37"
"429","215","86","2","Environmental time ahead born half blood movement lawyer like collection cause light.","","1983-11-01 02:08:05","1980-10-24 02:18:22"
"430","490","77","4","Money north pick stuff speech song culture front.","","1983-05-11 16:55:17","1982-10-26 01:32:06"
"431","570","34","1","Have executive cold walk long son teacher policy sell where occur time citizen.","","1983-11-26 22:47:43","1996-05-13 22:52:29"
"432","544","88","5","Sound page spring fish market American fact get base suggest director only benefit.","","1991-05-14 22:03:08","2008-02-15 07:13:19"
"433","396","3","1","Natural culture go order free indicate his mind debate they rest party.","","1995-05-16 17:25:58","1993-12-28 01:01:50"
"434","262","13","5","Exactly without dinner age less reveal team stock small friend fill difference whom.","","2012-06-14 22:39:57","2011-08-17 02:35:14"
"435","63","31","2","Million adult including American middle add stand exist us development arm through.","","2000-11-05 06:02:38","2022-04-28 18:42:27"
"436","473","19","4","Market official area boy nearly sit recent although one response nice baby cost.","","1979-04-01 03:39:44","2003-01-27 23:25:36"
"437","490","66","4","Among message because action already challenge language week crime body property everything analysis environmental cup.","","1993-07-10 16:56:53","1995-07-15 05:07:55"
"438","138","89","4","Billion wide full wind sister audience sell against weight Mr.","","2021-01-08 10:19:13","2016-01-19 20:08:24"
"439","37","70","5","Short serious option understand box note course forward win it care society fish.","","1989-01-12 09:18:55","1975-05-28 03:00:50"
"440","492","31","2","Their art daughter purpose yeah simple still stuff response.","","2014-01-13 11:30:09","1996-08-23 09:36:31"
"441","116","15","2","Player suffer store hundred color across while.","","1975-07-10 02:32:00","2012-07-25 01:13:58"
"442","496","84","1","Success short set white throughout yeah very.","","2008-11-24 02:21:39","2016-10-15 07:07:30"
"443","587","67","2","Congress protect ready individual time commercial company another bag because.","","2010-05-01 04:13:40","2019-03-08 13:46:00"
"444","166","34","1","Table traditional trip probably cultural create question source himself design.","","2006-10-13 21:50:40","1990-11-25 08:31:54"
"445","166","7","2","Center will cause president see move media ever large.","","1980-06-13 08:04:55","2023-04-30 02:59:10"
"446","233","97","1","Method subject voice skill enjoy include detail education example meet poor do while ok set general.","","1996-11-05 07:58:23","2019-08-19 23:29:03"
"447","270","28","1","Professional list major subject good pull manage rock action around decision treatment enjoy light.","","1971-12-26 06:27:16","2019-07-08 07:51:58"
"448","207","54","1","Follow war likely pattern whatever live rock rich again test even use reduce though set there.","","2012-10-24 12:06:13","1994-10-29 21:51:37"
"449","294","14","1","Reach nice charge officer whose message so send it decision.","","1978-01-27 16:42:16","1974-02-13 10:48:32"
"450","207","6","5","Some project drive operation sport same name push with including fish others family reflect possible.","","1970-05-12 21:57:31","2003-11-04 19:40:02"
"451","256","82","1","Parent avoid statement far more camera hear throughout nice.","","2011-03-07 22:35:13","2017-09-03 01:31:41"
"452","24","45","1","Military really former factor alone region find family national himself scientist away have employee describe.","","1989-08-27 00:53:46","2004-09-22 23:04:55"
"453","455","1","2","Star series organization green challenge right minute produce.","","2023-03-17 03:23:08","1993-01-06 22:02:26"
"454","377","10","2","Term build positive brother forget six chance line suffer matter rate piece.","","1982-06-25 19:57:46","2018-08-07 19:49:42"
"455","16","64","1","Yeah rule live able enough back still.","","1994-03-21 12:04:25","2005-04-18 12:52:03"
"456","595","40","1","Power hope suddenly relate same beautiful turn gas dream into program then candidate over change wonder.","","1997-04-15 08:35:20","2008-06-26 00:56:18"
"457","239","50","2","Every church again night treatment relationship democratic body service.","","2009-02-27 11:47:54","1998-04-26 00:09:58"
"458","214","96","4","Heart wonder will type model sense onto interesting director.","","2019-02-25 19:04:42","1993-09-10 01:35:25"
"459","572","78","5","Draw expert chance these middle officer affect probably.","","2000-07-25 04:10:33","1979-05-12 12:14:49"
"460","549","65","3","Community food sister break course behavior care morning grow follow inside store town task.","","1997-12-25 08:39:30","1979-12-23 18:42:26"
"461","317","21","5","Such month how address indeed three responsibility young life Congress industry.","","2002-03-11 12:47:06","2006-04-02 07:28:02"
"462","201","13","3","Growth rise maintain beat government camera Republican.","","1976-05-28 14:38:07","1989-02-11 23:01:10"
"463","446","25","4","Attorney think prepare foreign game him foot.","","1997-01-17 09:52:40","1986-01-28 20:07:36"
"464","563","30","2","Though pattern sit accept every performance strong financial.","","1983-07-05 05:43:07","2006-03-30 08:47:01"
"465","351","55","4","She gun low single human rather art edge seven.","","1998-02-02 19:12:47","2023-03-20 07:27:58"
"466","397","90","2","Under focus when ground majority protect able political pretty suggest member design will dinner.","","1984-03-10 15:09:44","1992-08-12 00:09:36"
"467","502","41","2","Project worker get occur people hair difference decide least open century item.","","1991-05-28 17:15:40","1972-07-19 23:21:42"
"468","181","20","1","Customer despite stuff couple beat nature phone allow phone character money soon may right.","","1976-10-31 10:48:13","1988-12-03 12:05:24"
"469","22","36","1","Difference use growth short camera teacher there environment child off computer walk American.","","2013-01-02 10:41:44","1990-03-29 19:48:28"
"470","33","86","2","Option consider bring difference no anyone add speak street way its better tonight less feel writer.","","1986-01-29 15:53:21","1974-10-28 08:56:38"
"471","180","55","4","Cover age budget cold college while administration unit thing.","","1993-05-29 14:25:39","1997-11-30 05:54:55"
"472","95","6","5","Light toward home several follow couple area everybody chance cost tax get Mrs office job.","","1981-11-08 10:23:02","1996-03-30 00:07:45"
"473","488","53","3","Just shoulder cell generation interest such clearly town room hope.","","2021-06-04 19:34:32","1973-05-07 00:43:42"
"474","269","38","1","Keep still strong international window decision statement consumer yourself world.","","2016-11-21 13:23:54","2023-02-28 20:26:28"
"475","525","74","5","Among above and toward whose international story cause member yes.","","2015-03-18 06:02:01","1975-04-22 04:11:09"
"476","389","54","2","Suggest hair middle new not audience clear.","","1986-04-03 10:25:14","2022-01-08 14:05:44"
"477","533","86","3","Prevent rule story city indicate instead sense anything.","","1991-04-14 08:09:40","2001-10-18 04:22:11"
"478","63","0","4","If none usually director opportunity produce lay anyone measure work focus sing.","","1992-05-06 00:54:26","1975-08-23 20:02:12"
"479","243","58","2","Radio must left night own clear magazine summer book.","","2012-11-20 05:04:47","2025-03-25 14:37:01"
"480","124","96","5","Region continue deep program return later begin room.","","2009-09-21 17:03:55","2012-10-21 03:55:49"
"481","275","75","2","Or great performance foreign great share important.","","1990-07-02 05:29:54","2009-07-12 17:33:37"
"482","523","78","5","Tonight benefit tell mother hit organization sport perhaps.","","1996-02-10 17:02:26","2002-02-22 11:21:45"
"483","475","58","4","Money push race until recently section listen notice himself address.","","2015-10-08 01:42:49","1972-12-19 12:48:55"
"484","548","77","5","Morning grow land build window six attorney public per want home skill public technology.","","2024-04-14 23:55:20","1973-01-12 22:03:52"
"485","67","42","1","Join organization represent worker assume watch six yet along week per property relationship economy explain main.","","1974-09-23 22:28:27","1971-03-01 04:20:25"
"486","266","39","5","Surface skill maybe final near perhaps may agree spring throughout live.","","1995-06-03 20:25:31","2017-05-03 08:06:04"
"487","341","7","2","Want those street job perform use organization feel mean hair shake clear all hour seem stock.","","1987-12-06 15:58:29","2020-07-26 07:51:05"
"488","496","11","4","Song TV fire require knowledge tell focus.","","1971-08-11 13:58:20","1970-07-25 20:35:16"
"489","183","41","2","Second catch institution especially ten interview think step go community series very site letter technology.","","1992-03-09 10:21:20","1987-12-24 20:36:02"
"490","356","74","5","Party stock guy magazine able tax with condition knowledge anyone wall main.","","2020-03-04 16:07:07","2006-10-09 18:17:10"
"491","142","19","4","Hair level anyone parent beyond eat general.","","2024-02-13 04:48:10","1987-09-22 18:14:08"
"492","577","47","4","Record happen prove today help according each great focus which voice.","","1987-06-08 16:52:54","2004-01-12 21:59:33"
"493","356","83","3","Change develop develop seven worker down evidence coach next.","","1995-01-10 08:56:03","2018-05-15 14:16:45"
"494","168","17","3","Lose decade the plan such edge situation meet camera right.","","1978-05-04 16:55:30","1977-08-30 18:39:59"
"495","402","83","3","Support expert five difficult animal wrong including continue at concern best respond.","","1981-12-04 17:22:52","1993-12-03 05:09:32"
"496","308","44","3","Compare act strong well maybe quickly appear or.","","1989-01-20 18:29:49","2014-11-18 04:45:20"
"497","168","78","1","List message put team particular beat kid impact southern too.","","2022-09-01 09:52:54","2018-01-01 05:20:01"
"498","281","40","4","Maintain feel floor industry raise growth total consumer show front community successful treatment local development.","","1987-11-02 10:17:07","2012-10-03 15:14:41"
"499","438","90","5","Pay instead participant Congress my although while baby increase thought picture available.","","2019-11-29 20:42:43","1992-06-07 05:09:24"
"500","149","47","2","Year establish just can left art TV any fire something gas child some event care.","","2006-04-24 01:52:10","2018-04-13 07:01:59"
"501","178","84","4","Building sea others everyone possible grow test condition particularly important really box north.","","2021-02-17 06:21:19","1995-01-06 02:29:43"
"502","487","46","5","Adult southern this realize responsibility mean others.","","2010-11-12 11:55:55","2003-08-01 09:16:59"
"503","552","46","5","Perhaps fish prove forget take human most remember we sense develop race appear.","","1976-01-25 20:37:48","2013-06-19 23:01:42"
"504","573","49","3","Ready that admit he tax know then energy nice after hundred military still have big.","","1970-08-02 06:12:58","1978-10-02 13:23:03"
"505","403","73","4","Magazine single which nation force goal measure voice though capital middle seat.","","2008-10-14 10:10:46","2003-11-22 15:12:13"
"506","491","85","4","Control pressure material protect fire important everyone image camera contain often firm build adult.","","1979-03-10 07:40:13","2014-04-01 23:05:32"
"507","339","97","3","Government third pull particularly black official break others knowledge window finally opportunity wrong coach identify life.","","1988-12-12 19:26:27","1994-06-29 20:50:49"
"508","196","70","2","Quality say good wonder deal receive join full send box trip our.","","1991-03-19 04:34:54","1994-01-21 03:42:59"
"509","298","45","2","Both picture one have project anyone trouble condition least different act realize number.","","1996-02-09 14:27:39","2015-06-03 03:41:51"
"510","542","50","2","Term society same place stand once side clearly move agent prepare suggest maybe official spend.","","2022-09-28 19:37:01","2016-11-05 12:38:29"
"511","487","94","2","Organization cause husband be class wide lawyer significant term image husband beyond heavy raise.","","2004-07-08 01:34:09","2001-11-06 15:12:09"
"512","190","61","2","Agree bill moment find research real several offer.","","1972-10-08 14:25:01","1984-07-29 01:07:50"
"513","267","29","5","Yeah miss agreement world view message available personal trip increase let third again.","","1982-10-03 09:06:10","2006-07-31 02:41:29"
"514","556","21","1","Allow building use million none although should leader man father court toward wear attack attack.","","1987-12-02 11:24:21","2015-08-11 06:46:34"
"515","598","76","3","Indicate himself nothing early cell really election far color worry you.","","1985-01-07 20:50:53","1979-07-09 05:05:59"
"516","29","15","4","Second past cover relationship pay other raise heavy toward maintain current career light wide article Democrat.","","1985-08-05 13:51:08","2020-05-19 09:51:53"
"517","426","82","5","Shake life artist little focus bad group seek away.","","2011-10-31 13:32:05","1992-01-13 01:31:45"
"518","5","28","4","Least base throw popular take attack rock voice.","","2011-08-19 07:09:37","2024-10-23 11:21:06"
"519","375","27","2","Argue why always stock growth last cause already language.","","1973-01-06 03:12:51","2004-09-02 11:34:46"
"520","270","78","5","Care still term mean tax between position culture use Mrs exactly four.","","2014-03-10 06:46:22","1989-08-19 02:46:57"
"521","438","48","1","North major thousand upon standard front memory house save head activity.","","2010-01-05 20:58:33","2009-03-16 18:22:35"
"522","212","65","5","Tonight north south maybe college full travel firm.","","2011-09-21 23:38:53","1974-11-29 01:34:38"
"523","581","32","4","Development another bit police step attorney term notice up without other consider drive.","","2006-01-26 02:46:33","1995-10-13 12:55:36"
"524","365","69","3","Table walk lot article ago subject wind example report start.","","1971-04-25 23:14:58","1975-01-13 04:59:24"
"525","475","25","2","To arrive interest together decade difficult focus see defense second media young stand take.","","1972-02-13 15:05:21","2023-10-26 14:54:04"
"526","273","33","2","Suddenly put or heavy majority join against happen.","","1993-01-08 09:41:35","1972-09-05 11:57:08"
"527","479","21","1","Personal realize minute low energy successful bad be great know attack position fall grow industry.","","1995-09-30 13:49:14","1995-04-04 13:43:27"
"528","577","91","1","Suffer discuss fill tax continue thousand like.","","1974-03-17 02:50:04","1976-07-07 12:26:13"
"529","149","73","1","Surface sit someone different cut capital road sea hold other movement determine.","","1976-10-27 09:33:26","1977-03-31 10:48:53"
"530","328","42","4","Argue prepare fact later huge even eat ability believe nation image few indeed.","","1982-09-02 07:02:16","1985-11-01 10:31:49"
"531","592","44","3","State back we produce camera treatment expect industry must fill center nothing pay figure.","","1983-06-19 12:38:52","2017-08-03 08:36:19"
