"712","341","35","5","Street message thousand before lose attention care other.","","1973-05-12 17:25:31","1988-01-28 04:16:30"
"713","594","62","5","Attack many interest never quality heavy guy among large one car feel attack.","","2003-07-05 14:20:51","2023-05-23 14:44:10"
"714","356","35","5","Similar north a present family people just recently remain blue.","","1971-09-03 23:44:57","2004-06-06 02:44:54"
"715","173","2","4","Strategy process behavior even grow gas certainly itself or add front Mr smile peace central.","","2019-11-13 03:29:21","1970-06-12 08:01:52"
"716","255","35","3","Level doctor stock least prepare owner my society too own society everything read list store.","","1983-02-25 18:21:11","2012-09-04 23:04:00"
"717","408","34","3","Loss figure lawyer assume likely indicate its now organization.","","1980-07-22 13:06:24","2022-02-06 09:22:57"
"718","18","46","1","Discover if camera imagine few need glass seven.","","1992-12-12 06:11:16","1988-06-06 08:22:29"
"719","592","82","3","Consumer along memory worry money rich field century star than in mention anyone.","","1995-08-05 18:13:05","1997-01-31 05:57:32"
"720","278","25","5","Task bit according couple thus personal movement record president military away yes character high box suddenly.","","1986-05-03 13:46:16","1971-08-23 03:21:59"
"721","329","2","2","Great remember as present base hope suggest own deep agree.","","1983-05-09 06:38:50","1988-10-25 17:42:33"
"722","533","44","1","Task win cause describe soldier paper add very consumer training.","","2014-03-29 21:21:58","2012-08-01 06:39:27"
"723","408","92","3","Manager some phone eye movie reduce but voice.","","1971-05-10 17:34:13","2016-11-26 20:50:32"
"724","524","20","4","The throw could realize writer method wait.","","1995-03-13 07:11:16","1983-02-07 13:44:07"
"725","269","85","2","Member become end its pass we she eye decide never there ability memory last score.","","2011-05-30 00:57:26","2005-03-12 11:41:01"
"726","545","34","3","For ground coach young couple four myself evening take me perhaps back technology apply low officer.","","2002-06-26 18:38:02","1993-03-01 02:55:21"
"727","540","37","1","Smile beyond share last woman once dream serious buy involve.","","1991-08-06 00:58:53","2019-01-03 23:59:49"
"728","564","19","3","Former same their American for task cost perform offer never town instead paper action every.","","1972-10-17 08:48:16","2019-12-09 22:41:54"
"729","138","42","5","Mr trouble yet factor avoid produce difficult couple increase.","","1987-09-20 09:05:22","2000-04-27 05:48:52"
"730","492","3","5","Off clear product picture individual artist parent most.","","2001-12-29 10:10:18","2006-04-18 07:34:00"
"731","368","83","4","Responsibility role director stop million behind may affect often this read foot.","","1989-01-04 07:48:26","2011-11-08 16:55:48"
"732","348","81","2","Film data move instead measure involve step program building investment.","","2010-01-08 12:46:28","2011-10-15 16:16:45"
"733","517","60","1","Employee lot main Mr discuss great way American action boy upon concern yard hope.","","2014-06-04 17:31:42","1971-09-21 15:07:29"
"734","444","34","1","Among determine firm cultural develop in writer mean control character call both.","","1994-03-12 17:48:22","1995-05-20 23:53:48"
"735","173","13","4","Out book wear back pay do above security left.","","1971-01-22 15:41:50","1981-06-26 17:47:07"
"736","68","64","1","Bring find teacher democratic within large still either door control agency break interview federal price.","","1993-02-09 06:26:44","1993-04-19 09:01:51"
"737","3","50","4","Score style better budget impact we above nothing join security young.","","2010-07-21 03:42:47","2012-03-19 10:59:39"
"738","329","20","3","Project guess chair we itself appear article.","","1978-10-20 16:42:36","2021-01-22 14:01:29"
"739","595","41","3","Economy size experience feeling available lay truth reality government among and.","","1976-12-17 01:18:18","1977-03-03 02:50:28"
"740","29","46","3","Tough dream thus executive court customer oil.","","1975-06-19 02:52:17","1999-03-26 21:01:11"
"741","592","24","2","Guess little later night yet almost behavior former maybe.","","1989-05-24 17:53:15","1980-05-28 14:57:45"
"742","490","12","3","Maybe suffer bit act about color major agree five.","","2019-03-14 01:28:46","2001-03-07 12:13:04"
"743","397","39","5","Author onto end view produce country off mind yet certainly.","","1977-06-08 01:55:43","1987-03-30 00:58:20"
"744","451","17","3","Hand cell truth group film dream notice opportunity me hot.","","1999-10-16 05:14:13","1983-08-01 07:58:21"
"745","476","79","2","Answer field hold bag pay nice budget down.","","2021-06-27 00:17:01","1991-05-24 01:05:06"
"746","389","23","4","Child east not become security young war issue throw boy.","","1981-02-10 22:21:03","1984-03-25 23:17:11"
"747","451","28","3","Ball imagine strong understand building want high trial administration read could trip.","","1979-10-19 00:49:08","1987-05-22 13:13:43"
"748","215","78","4","Perform voice tax buy your success today group relationship major special partner.","","1978-03-01 21:39:51","1977-05-02 14:42:50"
"749","87","11","3","Budget test participant social mission people form friend attention mind break night result design end.","","2023-09-16 20:14:04","2010-03-02 03:15:18"
"750","404","50","4","Value south themselves show money item would ground individual enough cup.","","1998-11-18 19:47:13","2002-03-11 14:06:45"
"751","19","18","2","New cause could together first late young often south.","","2019-12-11 04:05:12","1985-10-25 01:40:32"
"752","278","65","1","Probably professional reveal wait certain listen painting dinner side free you general my dog.","","1992-09-12 02:48:40","1988-02-14 08:35:56"
"753","551","47","1","Raise sit artist report space treatment result say our night movie compare middle hard late degree.","","2010-05-30 12:54:44","2014-02-10 06:34:10"
"754","440","4","2","General today choose board development raise civil brother impact beyond may base money.","","2001-08-21 23:36:32","1981-04-09 03:00:59"
"755","455","18","4","Congress certainly morning board pattern myself glass right once evening more position.","","1996-12-09 20:26:19","2014-08-31 08:04:29"
"756","266","61","2","Eight you yourself despite music item country adult lawyer.","","2014-09-23 15:55:48","1989-02-12 10:24:13"
"757","24","57","5","Successful leader sea control cost authority various young make think.","","2010-11-21 09:13:19","2005-11-08 21:58:24"
"758","337","62","2","Appear dinner unit agree professor control ago tonight.","","2011-06-07 04:58:06","2004-12-09 23:22:54"
"759","234","14","4","Cold impact option sport buy brother air more ground religious live range loss.","","1984-07-22 12:24:52","1988-06-17 18:59:24"
"760","471","85","3","Class such law listen floor parent sign wait you early.","","1994-03-18 10:19:13","1970-12-17 19:41:31"
"761","595","8","1","Radio specific base authority if law other everybody step speech language bring challenge join.","","2012-02-16 09:05:25","2015-10-02 05:16:33"
"762","507","1","1","Fact say place party trip family sister finish.","","1975-04-13 08:51:55","2004-06-20 01:04:36"
"763","244","93","3","Well what such course free create road control.","","2016-11-26 10:10:32","2020-12-01 22:38:45"
"764","409","69","4","Staff vote too south join marriage term growth reduce hear foreign process team effect his.","","2002-11-21 13:45:10","2023-07-09 16:28:20"
"765","3","48","3","Likely oil world price color special nor include meeting sound it determine occur American another indicate.","","2016-01-18 01:14:23","1989-08-02 21:14:37"
"766","528","72","1","Whole local smile company sense product cultural alone forget despite statement tell particular decade table participant.","","1982-02-10 20:34:54","2023-06-01 19:21:34"
"767","440","96","4","Them worker head necessary guess attack material view hit cell must scientist brother serve.","","1993-11-06 17:56:30","2008-07-20 13:05:50"
"768","142","42","1","Audience about chair it order area pick.","","1971-04-30 15:55:49","2007-01-01 03:49:47"
"769","233","31","4","Those Mrs we play act character student road air cell alone actually music discussion.","","2008-06-30 08:50:00","2013-02-24 16:55:55"
"770","33","3","1","Page drop sister white nation sit beyond him skill very above represent follow hope result beautiful.","","2024-04-27 17:58:21","2009-02-13 20:29:12"
"771","572","34","1","Need mean letter fill day test into tree dream western.","","2011-07-08 15:07:20","2008-08-15 15:40:22"
"772","239","28","5","View safe myself gas establish hand day career century themselves party production ready allow.","","1981-10-13 00:59:13","2009-02-15 17:48:05"
"773","507","12","4","Meet thus I scientist specific together some participant discuss level blue international probably.","","2010-09-28 15:21:53","1980-01-27 04:08:26"
"774","411","11","4","Risk although although technology case situation money culture reason thing ground.","","2019-03-08 21:30:44","1991-08-08 20:33:37"
"775","219","86","3","Within top tonight agree rock live red reality.","","1971-12-21 09:28:07","2018-07-18 21:40:17"
"776","36","2","3","She mind compare positive white second bank maybe up run item early degree.","","1995-02-04 23:42:20","1996-08-20 18:32:05"
"777","162","48","4","Various contain recognize on blue picture life once sing pick media design mother many air.","","1978-05-02 00:46:55","1990-10-04 05:30:47"
"778","5","94","3","Character third way get expert true similar.","","1978-06-29 02:16:52","1979-08-28 04:22:10"
"779","351","73","1","Pressure tend health she stock ask value tough forget low hold radio involve debate nice.","","1980-11-06 16:36:52","1988-10-20 10:08:23"
"780","250","73","2","View mind individual leg suffer but board every glass third book today style method several.","","2015-09-26 16:53:31","1972-10-04 12:16:39"
"781","542","68","5","Local lot music house they because though power yes.","","2007-04-23 17:30:48","2008-02-09 23:56:32"
"782","73","36","5","Hot plant blood parent mission their very door most.","","2022-02-09 01:06:58","2017-08-03 07:04:10"
"783","573","31","3","Only tonight cost strong avoid way thus heart few agree decade tell everything figure realize.","","2018-05-04 11:53:54","1971-05-12 17:50:15"
"784","301","66","5","Knowledge responsibility able enough feel could citizen season hair cost probably.","","1974-02-07 06:26:55","1991-08-17 06:05:12"
"785","270","38","5","Away six always deep business such building movie.","","1988-11-21 15:39:41","2020-07-06 15:59:05"
"786","434","94","4","Organization source woman blood research hit despite discover which argue.","","1979-01-15 13:39:58","1979-08-28 23:54:41"
"787","308","12","4","Open garden he professional shoulder everybody moment world check.","","1991-09-24 00:55:55","2014-04-17 18:36:05"
"788","402","37","1","Effect town spring road hit consumer remain religious interview third step tonight knowledge.","","1972-11-01 08:48:51","1992-05-15 12:59:31"
"789","236","81","4","No evidence program offer table cover truth.","","2013-10-12 23:48:34","1988-12-21 21:49:11"
"790","356","61","5","Wide back article case easy man pull thing west scene sense doctor discussion.","","1975-05-30 09:14:37","2001-11-13 14:46:44"
"791","378","27","4","Friend bag more television box guy program.","","1984-09-20 05:34:12","1996-04-06 20:16:17"
"792","496","57","4","Camera fine so toward color feeling Mr crime price under then boy camera owner or.","","2008-10-01 22:41:47","2016-03-26 05:05:12"
"793","241","4","5","Southern anything wear public staff he we soon be author paper trial.","","2011-01-24 06:40:18","2018-08-27 10:18:51"
"794","234","59","1","Condition Mr individual market week building reason knowledge home.","","1977-01-25 01:25:28","1979-07-22 05:50:11"
"795","508","34","4","Reduce develop increase national hand office our save professor.","","1972-06-05 02:56:14","2018-01-20 03:45:52"
"796","508","42","1","Physical trip southern event question major enter both where picture ten finish much which get claim.","","2011-12-22 22:59:14","1979-10-31 13:08:42"
"797","368","18","1","White safe quickly industry which direction six analysis top almost usually majority.","","1985-01-25 13:40:38","2014-04-30 08:01:50"
"798","549","61","1","Brother career long never man everybody power brother during million find condition six member model.","","2022-12-04 20:24:31","2000-09-10 05:20:38"
"799","505","68","5","Environment play ability enjoy enter window exactly my apply church owner.","","1983-09-10 08:26:27","1978-07-07 12:47:02"
"800","132","83","1","Responsibility buy discover subject begin improve cup thing technology last would suggest former.","","2008-04-05 20:00:50","2022-06-09 00:04:06"
"801","525","41","2","Grow central produce have matter parent network.","","2022-04-21 01:37:00","2005-01-24 14:23:41"
"802","518","9","2","More might answer sign community provide against recently model close create quickly.","","2013-02-10 01:15:30","2018-12-17 04:06:15"
"803","158","57","5","Although break of knowledge voice near matter cup write.","","1988-09-04 10:25:14","1977-02-14 15:54:02"
"804","446","46","1","Move edge decide one soon cell address might.","","2019-07-25 20:21:15","1999-04-21 04:12:34"
"805","261","72","1","Account data everybody shoulder show especially couple laugh authority structure way paper doctor couple.","","2008-09-12 13:16:37","1986-04-21 14:15:10"
"806","588","40","1","Stay computer idea recently how risk hospital receive argue see.","","1972-10-26 20:31:20","2008-10-30 11:52:24"
"807","540","21","2","Kid religious half law of education those others left lay push.","","1979-08-12 00:08:06","2008-03-03 18:46:12"
"808","69","87","3","Seek factor like hard head end everything use significant perform free.","","1988-12-15 08:12:10","1995-02-26 09:13:00"
"809","239","35","5","Could life thus difficult less own watch appear mind father and establish.","","2005-01-23 15:31:37","2000-08-07 23:46:18"
"810","175","97","4","Development section perform green far either child draw teacher huge fly car.","","1978-09-30 17:33:24","1990-09-13 05:12:02"
"811","417","8","1","And line dog look ago agency during trouble.","","1974-05-01 15:37:39","2014-08-17 12:15:57"
"812","33","15","1","Provide former discussion federal fight in set.","","1987-06-16 01:33:29","2022-10-12 03:05:11"
"813","598","94","3","Star national notice enough decision born have once left network by all.","","1990-10-09 13:30:12","1984-12-27 12:01:25"
"814","564","35","5","Each bring subject trade right per late leg camera fact.","","1979-10-15 19:04:33","1987-11-22 03:07:33"
"815","18","24","1","Physical three our bag behavior likely student save guy chance sing rather scientist.","","2004-12-12 23:22:07","1975-04-27 14:56:37"
"816","266","63","1","Window become like change conference discussion few sell rise glass staff week star summer structure.","","2012-07-10 02:20:32","2014-07-01 15:40:48"
"817","339","32","1","Whose decide loss five west old as.","","2017-09-13 03:16:31","2003-10-28 19:33:43"
"818","261","69","2","Tonight beat rock cut anyone this expect what wonder this.","","1976-07-20 14:46:45","2000-12-28 11:38:18"
"819","455","62","2","Room yeah research process issue simple future phone today effort shake trip get.","","1975-12-09 19:17:49","2021-08-23 21:47:12"
"820","375","55","5","Choice statement catch goal travel today study practice executive why write concern explain.","","2021-08-09 12:42:52","2016-06-22 10:39:04"
"821","160","27","2","Evidence itself must include their because everyone reality all.","","2023-06-25 07:44:17","1988-02-29 05:55:18"
"822","125","81","4","Nice clear rule various star clear describe.","","1991-03-07 23:00:28","2019-09-02 19:56:35"
"823","24","34","4","Question action its federal good call teach note institution will entire democratic best nearly.","","2022-09-30 12:34:07","1983-02-23 01:10:26"
"824","533","84","1","Very air alone accept too reflect Congress economy start do.","","1974-05-30 20:49:02","2007-01-16 12:29:00"
"825","333","40","4","Forward seem meeting same either employee other in choice board.","","1987-06-07 16:44:54","1995-10-25 17:58:51"
"826","156","51","4","Two continue camera final call computer figure fly source many air claim authority.","","1972-05-09 09:34:25","2004-01-15 17:11:24"
"827","375","88","5","Stop stock political do travel possible majority Mrs.","","1994-03-27 23:50:19","2009-09-12 16:34:44"
"828","224","44","2","Mission them last society just dog song into yourself understand court try.","","1971-02-24 07:32:06","1993-06-09 21:05:43"
"829","440","46","3","Offer miss more serious land degree drop explain care other fire wife manage might debate.","","2023-11-01 10:45:07","2017-07-19 20:44:17"
"830","319","57","3","Cause key thing increase arrive smile stay any see line dark build bag site current structure.","","2009-06-05 22:32:26","1992-11-07 15:12:31"
"831","329","73","3","Body couple speech wrong include call wide.","","2019-06-08 17:35:04","1999-07-25 09:07:25"
"832","540","20","2","May left camera admit work huge defense policy serve tough kitchen follow medical.","","1996-06-05 18:15:36","2008-06-21 18:28:34"
"833","577","69","4","Long most one once most despite grow threat any year within across news dog body face.","","1977-10-11 01:51:20","2005-03-15 13:07:55"
"834","533","6","3","Through unit down page action sure avoid idea network put these truth.","","1978-08-02 10:23:12","2018-10-05 04:12:08"
"835","341","45","1","He consumer themselves force effect election hour purpose billion the including none you summer claim movie.","","2007-08-10 08:27:54","2022-08-03 20:03:03"
"836","87","22","2","Matter health probably piece analysis level specific try a democratic worry truth because.","","2005-01-06 15:44:26","1971-02-25 09:42:22"
"837","478","90","2","Occur hope thing help toward nearly base future sure amount population during point.","","2006-07-08 15:22:30","2005-08-12 23:29:14"
"838","143","41","5","Night technology benefit baby environmental lose throw national big prevent miss interest marriage address.","","2000-10-16 03:10:56","1976-11-25 06:50:38"
"839","597","95","1","Offer act myself item scene scene west understand song party.","","2009-10-14 00:57:54","1973-03-24 09:51:31"
"840","376","12","3","Beat hospital south civil live raise moment matter board thing happy mention share hear create.","","1999-02-04 14:10:19","1971-11-21 01:29:34"
"841","405","28","2","Drug among lead wear throughout keep position.","","1974-11-13 12:06:10","1985-10-29 08:14:31"
"842","334","19","5","Play up marriage maintain season green strong let despite source successful friend father return order share.","","1990-01-16 22:21:00","1977-07-15 12:40:56"
"843","292","90","3","Speak other drop society scene four also mission administration clearly garden open person rate size.","","1998-07-08 18:03:31","2018-11-22 17:04:20"
"844","198","6","4","Big level few remember under answer building its far read.","","1993-04-10 13:32:00","1993-02-01 23:37:17"
"845","356","8","2","Do conference heart stay cell game boy step blue quality enter herself like change drive series.","","2015-03-27 06:00:31","2024-10-04 17:12:02"
"846","113","93","4","Military focus report can tonight enter success table her focus.","","1979-05-08 12:26:48","2002-11-28 16:55:57"
"847","443","52","1","Writer important only paper series seat citizen smile kid ago bag beyond practice morning itself.","","2007-10-16 02:55:32","2008-03-06 07:27:50"
"848","224","36","1","Think effort assume wife clearly become add remember.","","2016-04-20 10:02:50","1985-03-28 01:34:18"
"849","516","84","2","Cause sport moment unit continue enjoy page write very heavy.","","2012-06-05 00:33:28","1990-09-13 15:17:26"
"850","233","34","5","Less major draw example together court population also office her chance room.","","2013-10-23 16:48:54","2012-06-14 03:09:51"
"851","387","28","5","Marriage seat officer fall rate care military back.","","2013-01-02 09:13:41","2018-04-25 07:56:34"
"852","341","71","2","Level success consider life thing that happen just record list day.","","1987-09-14 21:01:29","1987-12-08 19:39:15"
"853","403","16","2","Discussion doctor everything officer focus deep behind before.","","1973-03-12 12:59:38","2000-03-19 20:31:15"
"854","146","68","4","Join wish door person past fly who arm tree number lose respond so specific still.","","1980-02-01 06:30:46","2023-10-23 17:08:05"
"855","49","34","5","Control physical phone sense PM time surface relationship protect mean resource establish.","","2010-07-05 14:13:44","1975-12-21 02:32:06"
"856","355","55","3","Available any near present start agree idea.","","1998-03-13 05:55:10","1983-06-05 09:38:26"
"857","244","46","3","Meeting likely could finally than the because administration start.","","1993-04-29 10:55:20","1995-03-24 02:33:11"
"858","396","45","1","Measure space simply half level example build former husband amount group never management family policy.","","1983-03-25 01:53:34","2014-02-09 08:00:34"
"859","471","10","5","Break late price seem visit many wall call.","","1990-06-22 03:33:02","2019-09-08 17:52:10"
"860","153","75","3","Ago but film great summer hair owner.","","1994-09-06 10:39:34","1972-06-14 03:44:42"
"861","3","40","2","Congress fish move deal station art security training.","","2009-10-04 19:36:53","2010-11-14 23:01:16"
"862","173","42","1","Do agency friend deep opportunity international happen compare could list consider fall kid main rich state.","","1991-09-17 02:56:19","2012-01-15 20:15:43"
"863","226","26","1","Only manager heavy else short bank movement.","","2004-04-01 04:22:02","1988-07-13 12:45:15"
"864","254","5","3","Charge market leader garden box general himself available exist own I material.","","1985-11-15 10:51:00","2006-03-22 05:48:29"
"865","250","20","2","Them name source concern machine require final back region black over scientist position computer meet coach.","","1980-01-06 09:56:09","1988-07-17 22:26:44"
"866","290","21","5","Everything sound card nature television all campaign year piece security finally resource upon.","","2009-09-02 14:20:00","2002-06-11 03:31:30"
"867","201","23","2","Shake especially believe might something term pressure including benefit make prepare third.","","1992-12-09 19:14:37","1987-11-07 11:06:54"
"868","5","76","5","Box building image reflect citizen tell back they official value hard remain return.","","1980-12-09 12:16:13","2000-01-23 22:06:15"
"869","200","52","3","News their history today concern light develop able.","","1991-05-25 05:00:02","2021-06-23 11:15:54"
"870","82","8","3","Heart data general team first remain TV black image open part happen share national.","","2009-08-07 13:04:12","2001-10-30 14:45:16"
"871","230","53","5","My example reduce some mouth consumer blue pattern story baby other girl.","","2005-01-16 15:20:19","1990-05-02 22:00:18"
"872","512","96","5","Sort collection appear key wall person decide country firm up year pattern.","","2001-12-19 07:30:53","2016-02-16 05:00:36"
"873","378","1","5","Law call court firm politics important finish ground ground sport TV become different.","","2023-06-20 01:18:19","2001-04-14 18:13:34"
"874","493","82","5","Go so evidence environmental arm deep institution particularly factor continue start.","","1976-10-16 21:06:22","2007-06-28 14:54:40"
"875","568","100","5","Reason value catch avoid two table heavy recent.","","1989-07-14 05:28:18","1996-04-05 22:44:10"
"876","168","44","2","Avoid entire create seek great son follow especially some international concern coach left rate option.","","1995-10-15 23:07:00","2003-09-21 19:22:55"
"877","66","0","3","Pretty agree second nation father last eye least realize candidate method security Democrat hospital business.","","1993-06-14 08:53:08","2010-10-26 20:39:44"
"878","524","94","4","Summer far expert family contain enough rather add report lose national million color process region heavy.","","1991-06-06 23:15:56","2024-02-04 21:24:55"
"879","455","5","5","Mr store anything race manager realize mention.","","2024-11-03 22:03:54","1993-01-25 16:28:46"
"880","175","56","5","Plan floor safe movement truth little cost but theory her form administration.","","2007-04-26 02:19:58","2025-02-24 14:58:37"
"881","107","68","2","Parent serve machine green worker throw including thus.","","2009-07-04 12:39:20","2008-03-23 04:49:36"
"882","478","47","4","Federal one perform stop capital young above good lay avoid in no director glass.","","2015-05-23 18:18:46","1990-01-08 04:55:55"
"883","204","50","4","Table to state baby employee thousand teach recently.","","1972-06-06 13:56:42","1988-12-30 09:05:36"
"884","404","62","1","Country example point win deal medical from talk next increase them know.","","1974-09-05 15:53:34","2023-10-15 18:01:36"
"885","132","1","1","Concern apply whom onto recognize again room growth describe down including.","","1991-11-15 08:37:28","1985-08-30 19:28:33"
"886","551","79","3","Law old ball threat certain north indeed base write side property type commercial ready ever field.","","2007-08-09 16:38:15","2016-12-12 01:00:57"
"887","348","97","1","Industry them weight college name sometimes identify never between appear Democrat site.","","2013-06-22 03:08:15","1993-01-12 20:00:15"
"888","464","36","3","Third hair determine miss local rule region single deep simply main other question.","","1997-08-28 08:54:46","2017-05-24 00:11:04"
"889","38","67","5","Determine level avoid walk rule small enough itself camera represent dinner.","","2019-11-27 23:25:47","2025-04-01 06:36:16"
"890","324","43","1","Imagine show economic center animal network safe explain want now size station environment response sister.","","2017-05-19 05:22:11","2005-08-14 00:57:53"
