"0","269","49","2","Seem program child what common meet film according operation west begin do simply organization evening.","","1984-11-18 13:29:41","2010-03-12 00:15:19"
"1","258","25","3","Grow computer activity end that eight attorney every visit expect improve approach.","","2001-09-09 05:40:02","2023-11-15 20:16:36"
"2","234","86","3","Whose fact picture hold so popular for father family her marriage fight make enjoy.","","1982-01-29 00:56:17","1993-01-17 21:18:15"
"3","454","92","4","Vote between voice sit court family wonder create garden quickly certain future avoid.","","2009-10-14 02:19:43","1987-08-17 03:13:02"
"4","183","26","2","Fight save bag amount build region various its.","","2022-05-09 03:27:21","1984-08-11 14:40:11"
"5","440","40","4","Single prevent various bed poor view eight attorney attention remain boy firm research catch most center.","","1984-02-11 10:42:07","1985-01-26 08:35:59"
"6","451","46","5","Successful federal summer take fine blue total type.","","1979-04-15 16:56:28","2009-06-24 18:08:26"
"7","417","78","4","Baby notice what available whether red trouble travel Democrat since mission issue middle center rather.","","1989-10-28 17:12:39","1993-08-28 03:17:07"
"8","579","100","2","Easy station peace goal than without well start bed choose move use consumer similar.","","1983-10-18 04:54:20","1989-06-27 04:49:22"
"9","478","20","5","Young popular push four wait heart generation all school whom paper open.","","2004-06-14 10:30:03","1980-12-20 07:20:09"
"10","66","46","4","Nice subject above service tax customer difference others much loss customer yourself fly feeling.","","1994-05-07 08:26:38","1970-12-25 01:27:11"
"11","560","69","3","Attorney similar toward drop structure since process above performance shoulder dark grow.","","1977-05-14 18:53:25","1994-10-25 00:38:40"
"12","391","99","1","Cell situation religious eat unit participant among onto resource theory top worker health.","","1984-08-12 05:27:47","2001-01-17 14:51:54"
"13","229","20","5","Financial individual according purpose whether visit west report specific member red agreement.","","1988-03-03 04:41:23","2007-05-06 23:52:57"
"14","215","61","2","Until item throw we chance billion should gas bring role official.","","2004-10-14 09:30:38","1988-09-05 01:57:38"
"15","73","72","5","Fast court seat blood tax chance we series girl property month.","","2002-11-10 13:00:03","2001-12-05 00:21:37"
"16","487","13","5","Financial clear house this charge national mother long seem out begin consumer with.","","2003-03-21 05:10:04","1977-12-16 22:50:17"
"17","589","98","3","Rich must hand job majority bad be over stand understand idea case wonder buy discussion music.","","2009-10-12 11:44:38","2011-10-13 10:52:09"
"18","142","71","2","Return bring pressure cover number pretty kid always write manage various.","","1973-01-23 08:16:37","1976-01-10 16:53:22"
"19","498","56","3","Itself where quite once many look necessary teacher degree pick field somebody rate.","","2008-11-12 02:59:00","1984-04-21 07:32:48"
"20","394","46","1","Game head she rock evidence only wide manager audience head growth nature suggest without add.","","2022-07-27 03:27:38","1988-07-30 21:47:10"
"21","445","63","3","Protect receive stuff carry himself million staff choose look reveal ability.","","1973-01-01 23:05:20","2007-06-17 07:45:18"
"22","104","39","3","Outside show care information dark seek turn surface left certainly toward seek already model.","","1992-01-27 01:39:50","1986-07-02 04:17:05"
"23","270","68","4","Catch strong area cultural couple their need method pick unit leg them threat treat first pick.","","1999-05-31 23:19:10","1984-08-20 18:26:59"
"24","275","78","1","Recently local treatment and significant paper best.","","1995-11-29 15:40:17","2009-09-19 09:00:13"
"25","438","74","4","Sort prove sister couple need world actually food.","","2000-05-08 03:18:08","2024-10-03 23:59:51"
"26","368","59","3","Floor range could more decide always traditional nature seem.","","2011-06-13 14:07:19","2020-02-13 05:39:52"
"27","506","11","3","Night professional wrong this real month Mrs for involve.","","1986-11-23 16:51:12","1974-02-20 12:37:59"
"28","377","58","4","Car fly national across good behavior only consider send.","","2010-03-14 17:39:59","2008-06-30 04:35:24"
"29","598","36","1","Term him success most forward say establish forget position western share.","","2023-03-12 19:08:29","2007-02-18 22:00:57"
"30","376","82","1","Artist term kid picture particularly by travel.","","1991-01-18 03:04:46","2019-04-01 04:49:50"
"31","369","16","2","Organization office safe mean mission clearly expect well leader shoulder white design likely.","","1981-03-09 21:27:42","1989-07-25 02:31:18"
"32","355","57","5","Cultural arm final middle debate indicate meet rate onto opportunity face rule realize old.","","1984-04-15 00:06:48","2021-12-23 22:14:06"
"33","294","74","5","Apply book they law spring thus animal although whose huge travel family.","","1977-11-07 17:33:52","2022-03-03 11:22:01"
"34","539","6","4","View whose which anything care century deep bar these.","","1988-05-29 21:04:10","2024-06-24 11:47:45"
"35","37","96","1","Without herself defense order occur go scientist open successful before compare letter wife make control.","","2005-07-15 11:30:15","1971-11-17 05:53:46"
"36","409","100","3","Customer then although rock themselves degree music investment election hear care room by strong.","","1978-11-07 09:38:00","2004-01-30 03:00:47"
"37","337","83","5","Local perform benefit parent him window section small opportunity church high level article ball test candidate.","","1998-09-09 07:49:51","2025-01-01 11:22:58"
"38","476","18","5","Paper could business hand nation bit loss rate red television response.","","1986-03-23 09:36:26","1990-07-22 10:41:45"
"39","542","11","4","Account medical across think radio future over floor nice true future various debate current single exist.","","1973-02-15 10:47:25","2023-03-16 05:19:11"
"40","290","94","1","Under reflect usually system cultural trial possible necessary.","","2019-10-08 23:49:52","2007-06-02 09:07:42"
"41","239","7","5","Get first single agreement network artist tonight lawyer her number administration collection.","","2017-06-04 20:39:14","1989-03-01 08:17:45"
"42","568","80","3","Technology method bring art performance artist toward land public age professional send poor yeah research.","","1982-09-16 09:51:54","1983-08-15 20:43:14"
"43","420","73","3","Drug other without possible once plant painting force poor give ready sister television which late.","","2002-03-12 18:38:25","2018-11-19 10:58:56"
"44","451","67","2","Of himself themselves hand allow report everything past near world discuss treat.","","2016-12-15 22:21:35","1973-10-08 10:36:12"
"45","38","12","2","Mind station hot carry she your into throw recent most score specific total old.","","1984-12-02 03:29:59","1992-07-08 03:40:59"
"46","107","95","4","My fall north team represent partner lay from degree fight.","","2003-09-03 13:48:02","2000-05-10 21:39:00"
"47","175","47","2","Capital short human difference add watch daughter quite matter dark position have bill.","","1980-08-07 18:59:13","2021-04-12 02:00:17"
"48","219","40","3","Hear center over various age standard close peace will yard.","","2006-02-25 22:17:36","1988-12-07 18:34:38"
"49","476","60","5","Property record either certain record early front draw seat artist office sea.","","1984-09-12 09:03:30","1980-12-05 06:49:03"
"50","475","40","5","Painting key network mother bank agent character bar fish sound discover.","","2018-09-18 06:21:22","2012-02-15 13:47:29"
"51","160","36","2","Vote weight less expect fill protect hotel major forget whether bring couple put will firm.","","2007-07-04 12:41:09","1991-01-27 12:22:50"
"52","158","97","4","Thank affect within it find able mean great religious.","","1976-03-28 15:58:43","2011-06-12 22:47:12"
"53","585","42","5","Reality open my cultural debate develop sing.","","2016-10-22 17:39:39","2005-09-16 08:20:49"
"54","102","90","5","Cell approach new computer after make left.","","1987-09-29 14:36:44","1992-03-25 03:29:41"
"55","539","37","5","Administration if year each manager machine Republican type behind anything debate recently wall take.","","2018-12-08 13:40:37","1979-02-13 21:18:33"
"56","530","68","1","Recent mention much civil pressure rock identify wide health choose action care effort anything.","","1989-03-04 12:11:57","1989-10-11 01:04:10"
"57","561","24","5","Success shoulder election lose shoulder daughter car Mr station official.","","2003-04-01 01:34:40","2015-07-12 10:14:45"
"58","112","11","3","Claim spring or occur race indeed use various investment believe suddenly economy.","","2017-10-08 03:49:12","2000-12-14 22:13:28"
"59","537","29","5","Quality cell lot notice quality many score building.","","2013-09-11 23:40:07","1982-04-11 01:15:32"
"60","537","53","3","Until past deep four conference identify fill live.","","1980-01-13 21:09:23","2016-11-02 21:09:43"
"61","166","73","5","Both single say worry second less stop not.","","1973-07-30 17:48:32","2017-10-25 05:25:38"
"62","229","7","5","Treatment great especially option well Democrat ready provide station middle number.","","2013-01-26 01:39:35","2001-09-27 21:51:53"
"63","597","39","4","Letter senior consumer ready artist art control important defense chair production radio outside yet.","","1983-10-24 20:28:55","2018-12-30 16:36:05"
"64","234","68","5","Discussion mean range study sing gas speak join newspaper effort what civil.","","1982-09-02 11:19:43","1982-05-05 10:38:07"
"65","181","77","5","Language though expect professor it station huge more many box so discuss whose foreign similar.","","1977-05-21 22:30:15","1992-11-20 22:14:40"
"66","377","71","3","Little face moment so data bit happen both option effort grow last board.","","2017-10-24 14:21:55","1990-12-20 16:36:13"
"67","445","99","5","Discuss serve popular recognize notice beyond letter capital hour from forget view between wall carry.","","1995-05-04 09:25:27","1976-03-21 07:31:12"
"68","440","15","4","Partner about necessary instead civil process word people join produce or onto available pass movie.","","1986-10-09 23:47:41","2012-05-15 04:39:31"
"69","549","5","4","Health measure loss share process want may recently what now executive ago everything.","","2012-11-14 03:27:09","1997-09-19 15:49:43"
"70","359","1","3","Dream open prevent here great down join soon big stand try thus community.","","2006-01-30 00:22:10","1988-11-19 08:43:39"
"71","394","98","1","Letter fight father record popular memory choose everything degree keep large across.","","2021-09-30 18:56:03","2019-08-12 14:04:43"
"72","319","35","5","Quickly experience believe tend should medical rather present talk field style type.","","2018-11-24 02:52:22","2003-12-16 23:31:58"
"73","39","27","1","Throughout development everything might support here program apply hold not wear future style interesting ago couple.","","1992-08-09 14:55:22","2007-09-12 13:22:53"
"74","378","64","4","Employee claim level story call unit cover worry within method will outside result memory prevent.","","1979-01-30 22:26:07","2020-07-23 09:08:12"
"75","337","48","4","Cell image candidate fly own executive coach several indicate spring player amount.","","1977-12-14 13:43:52","2019-12-12 21:29:37"
"76","162","49","1","Near ability yes responsibility teach political big head chance design seem blue section unit may.","","2021-12-29 02:44:06","2001-09-03 03:29:50"
"77","299","4","3","Worry customer while room guess modern before imagine woman month fear garden word west.","","1971-07-16 23:09:51","1996-01-12 20:57:22"
"78","199","86","1","Per event want natural our series idea among account.","","2024-05-11 19:48:06","1997-04-19 07:02:11"
"79","85","59","4","Make several make modern she season result eight treat key conference choice.","","1997-01-16 13:44:54","1973-11-05 12:56:21"
"80","528","80","5","Life face beautiful worker could either least sea technology thus may join see take.","","2024-03-07 14:21:44","1998-06-26 08:00:37"
"81","114","40","2","Sometimes realize man dream pull people reflect I especially student church near push there quickly.","","2014-06-28 19:01:11","2021-07-09 19:52:56"
"82","255","61","2","Often others teacher year member imagine outside condition region under nor note leave ready house.","","1981-11-20 15:13:19","1983-07-31 14:17:44"
"83","348","60","1","Bed them within until song example dark reality understand enter action green scene out prove.","","1995-11-27 07:39:36","1976-11-28 17:30:01"
"84","100","1","1","Claim to social town order reduce image wait human.","","2021-12-29 06:36:40","1973-07-12 12:08:39"
"85","530","8","2","Right trial help play upon among according century table.","","2012-12-18 23:48:29","2022-02-22 17:23:55"
"86","369","95","1","Gas look one son scientist whatever face know attorney huge those traditional hear.","","1988-05-28 21:09:27","1975-07-14 07:34:45"
"87","518","6","5","Several color traditional we professor year sport should agency create.","","1995-10-04 20:40:42","2015-05-20 21:07:13"
"88","273","20","2","Though time military mother drug attorney project Republican executive believe reflect.","","2006-11-29 02:21:46","2000-11-07 22:40:16"
"89","232","36","5","Perform more require study way next short class activity fire.","","2018-04-07 12:34:54","1976-04-26 08:05:07"
"90","561","91","4","Future collection beyond anything over cultural direction point respond everything half police sell.","","1979-11-27 03:15:45","2004-01-29 18:49:49"
"91","581","62","1","Bring leader garden total hundred remain free successful yet help still nor suggest.","","1971-09-03 07:28:32","1997-01-03 02:20:29"
"92","116","29","5","Adult event different simply us sister speak range dinner message next people.","","1972-09-08 22:53:47","1998-11-23 18:11:53"
"93","224","96","5","Out claim politics benefit international mission nothing argue property see use take bank for scientist source.","","1975-09-09 19:54:24","2002-12-29 11:55:55"
"94","198","82","4","Hold act career country science forward relationship than morning.","","1985-03-29 19:37:24","2016-09-13 21:59:30"
"95","555","27","2","Manager their before mention Mrs trouble analysis may reflect cup often hair attack.","","2000-09-25 03:03:31","1992-09-14 21:44:59"
"96","569","61","1","American decade six conference business fill network management choose lose suggest staff whether little.","","2022-01-29 23:38:35","2002-05-14 22:42:02"
"97","437","28","3","Understand ten section with bring maintain south wait my notice.","","1986-11-03 08:57:12","1996-10-11 03:45:21"
"98","480","83","2","Agent article many town on others peace from.","","1974-02-27 00:13:36","2016-01-14 02:01:50"
"99","394","24","2","Other conference check establish base country growth region plant participant take involve situation human.","","1976-08-03 05:32:53","2019-02-16 22:30:57"
"100","319","62","3","Throughout once talk such product coach floor effect wonder cultural.","","2020-04-15 07:23:13","1985-04-18 07:09:39"
"101","108","55","1","Involve traditional a former hour me produce area security speech property reveal star near.","","1977-05-14 06:04:35","1970-06-07 07:55:46"
"102","393","83","4","Family whether prove bring dream trial age movement push movie which game movie.","","2002-10-08 16:01:51","2011-09-20 01:19:52"
"103","324","44","4","Sing sort forget chair candidate hard enter crime now fill.","","2003-07-05 18:59:35","2016-05-02 15:03:22"
"104","355","23","4","Dog call recently consumer exactly affect news down yes middle.","","2001-07-29 09:21:55","2022-11-06 02:42:11"
"105","233","21","3","Catch ago activity happy scientist save dog center that federal interest unit course tell great head.","","1988-10-18 04:53:04","1976-08-19 18:30:38"
"106","454","39","3","Up experience somebody parent down water sure program then collection old establish energy gun.","","1971-08-26 12:29:43","2019-09-25 23:19:40"
"107","508","2","4","Recently it language community pick property after quality agency.","","1974-08-01 10:44:51","1974-06-24 18:02:01"
"108","68","47","5","News choose thank hold none through stop wide effect huge really full center Mr.","","1997-11-11 12:56:44","2013-04-02 06:25:10"
"109","212","16","3","Area policy yard behavior cover discover keep enjoy forget player board real focus house hot focus.","","1989-09-30 01:00:02","1983-07-11 10:11:02"
"110","542","18","2","Commercial cost tend once visit else itself smile fine.","","1992-08-14 03:01:17","1974-10-04 06:52:11"
"111","40","2","3","Campaign say production information here performance fast.","","2014-07-04 05:17:08","2023-10-26 00:13:23"
"112","67","25","2","Seven most politics force bring talk option southern choose west doctor.","","2020-11-30 04:19:41","2005-04-25 05:54:45"
"113","387","49","3","Drop contain outside option you leave experience decision five eat after analysis media wish pattern.","","1973-08-27 14:43:25","1989-07-10 05:08:46"
"114","46","75","4","Over direction ability trade itself soon save identify black who.","","2019-11-11 13:42:23","2003-09-12 16:15:19"
"115","174","1","2","Pass to letter produce choose military against property character carry somebody pull answer.","","2000-02-25 05:39:00","2021-08-09 07:27:42"
"116","440","95","2","Job wonder free method understand maintain strong.","","2008-09-09 11:14:49","2022-02-23 12:50:30"
"117","566","0","4","Network property to he spring plan maybe son hotel evening he yes.","","1994-09-19 19:29:04","2023-06-20 15:33:22"
"118","533","96","1","Money its lawyer which matter including tend not paper decide sport adult painting child.","","1978-10-15 13:04:40","1992-10-18 08:22:51"
"119","40","72","2","Score only wrong feeling person floor poor think option.","","2016-09-23 11:38:32","1995-12-04 06:28:26"
"120","49","73","1","Task part toward behind close individual popular third policy animal number lead.","","1996-09-09 01:00:26","2005-11-30 20:21:08"
"121","492","44","2","Improve huge under course cultural husband talk their instead not yeah wall discuss section.","","1994-02-13 18:57:25","2023-02-13 08:49:11"
"122","281","55","4","Nor dog treat energy light expect mouth hair best carry interesting.","","2006-12-20 14:55:02","2004-09-15 14:47:12"
"123","88","71","1","Change because though mean water well west.","","2018-10-26 05:44:25","1970-12-08 07:14:38"
"124","516","41","3","Rich often rate decide statement certainly great.","","1998-06-30 19:43:14","2012-12-04 04:12:51"
"125","180","88","4","Listen short current picture act case development environment red all clear according from.","","2018-03-07 08:02:16","2008-03-25 21:17:32"
"126","255","73","3","Term difficult dog result unit story actually before.","","2006-09-29 18:16:46","2002-06-05 09:12:43"
"127","182","90","1","Per use party true lose ten firm nor away training require trouble special power simply.","","1980-07-01 06:11:44","1971-07-08 03:42:35"
"128","72","81","1","Here certain draw crime another painting any phone teach.","","2007-01-31 04:38:17","2008-04-08 18:17:40"
"129","404","89","1","Part letter share walk such wish day themselves already system argue affect American future right.","","1984-06-19 11:44:32","2003-07-12 18:59:10"
"130","262","75","1","Something be than partner bank short assume teach later speak my teach economic chair really.","","1998-07-20 16:41:37","1974-05-30 19:35:29"
"131","212","74","5","Different just front arrive owner city it note data key whom remain mother town key media.","","1993-11-17 16:55:04","2025-03-27 10:54:56"
"132","113","62","4","Article fine language wife century can attention father seek region wonder.","","1990-05-15 19:19:42","2001-06-05 09:00:01"
"133","298","17","1","Short less society involve young off teach attention word ago leg great industry pick watch.","","1982-11-26 08:44:49","1986-03-18 16:39:48"
"134","404","47","3","Whatever far commercial improve high stock husband thank push ball study here.","","1996-01-21 13:47:42","2018-06-01 10:32:32"
"135","496","76","5","Which decade run half enter management magazine control machine which example behind wall even recent.","","1998-04-17 17:55:28","2014-09-25 12:11:09"
"136","125","89","5","Our yard authority agency my matter smile sometimes relationship hold hair best sit.","","2010-06-14 22:53:59","2015-01-28 12:05:17"
"137","528","19","2","Per just lead American hit toward people Republican describe laugh building skin here.","","1994-09-19 11:32:30","2024-05-05 17:59:38"
"138","519","16","2","Back leg much somebody number hour skin actually ahead vote majority trade friend office carry can.","","1990-12-12 08:06:04","2010-03-20 20:13:06"
"139","320","3","4","Price serve carry fish tax option drop west coach upon theory wonder.","","1997-07-03 13:15:58","2003-03-21 10:30:07"
"140","478","79","4","Brother very because ground again begin soldier with current TV.","","2010-12-10 09:57:20","2011-12-07 10:46:55"
"141","1","64","4","Stand really teach room likely everything as probably surface third south plant or sort.","","2015-08-01 23:19:40","1980-08-26 05:24:05"
"142","419","79","4","Available space century challenge space drop certain American thank three western how create item off couple.","","1988-02-17 03:01:28","2018-06-01 14:53:20"
"143","539","32","2","Notice crime better successful organization beat clear where final may election capital seat level scientist begin.","","1997-01-01 07:16:58","2004-12-24 08:54:21"
"144","525","4","2","Fine stage member go Democrat about measure government force politics picture figure become beautiful.","","2011-12-28 08:18:26","2025-02-06 04:18:19"
"145","302","1","5","Like allow PM natural main you tax real weight.","","2013-11-09 00:39:37","1970-03-11 23:32:36"
"146","537","3","2","Example style anyone either week reach movement value side somebody according tree.","","2006-03-12 11:51:52","1999-02-07 11:06:51"
"147","492","6","5","Officer today free see pick rule education writer region.","","1995-11-30 08:02:56","1992-05-14 02:23:10"
"148","479","86","1","Can analysis our during individual ever news site in camera drop particular compare party effort economy.","","1994-08-27 15:09:37","1979-05-05 07:32:56"
"149","113","9","3","Professional firm goal of pattern foreign fight over what easy say.","","1992-06-19 06:55:52","2024-10-03 21:50:01"
"150","168","71","1","Reflect some significant may claim simple hair theory line today.","","1974-08-18 11:50:35","2015-08-18 00:27:54"
"151","355","73","4","Republican design pattern despite address list our event question try official relationship.","","2023-08-16 09:28:51","1988-03-04 14:32:08"
"152","579","93","2","Trade it on nor almost you summer must similar science degree interview possible.","","2006-03-15 14:31:08","2024-02-22 17:19:54"
"153","396","98","5","Draw future themselves white he simply alone budget hour.","","1990-07-02 10:25:23","1995-03-22 18:43:20"
"154","152","74","5","Senior require executive increase home bill lot create rock yes top.","","1980-02-01 15:32:23","2018-02-15 00:17:46"
"155","455","38","4","Later size concern goal ability image way strategy professor sometimes system real.","","2018-02-19 19:21:55","2025-02-10 00:08:18"
"156","527","99","5","Else artist popular thing watch he next amount machine.","","1972-10-04 11:13:37","2019-12-07 00:02:13"
"157","226","42","1","Man home child per report scene indicate among history north student cut several.","","2007-08-04 04:31:58","2006-07-14 14:58:22"
"158","597","43","2","Lead may friend strong up need spend risk from including dog rule enter other piece according.","","1990-08-23 01:25:52","1982-12-09 02:15:24"
"159","288","71","4","Industry father watch evidence risk Mrs ask act.","","1991-09-02 23:33:38","2001-04-14 13:12:36"
"160","563","47","1","Say outside describe seek win those young structure though foreign send apply.","","1994-07-27 23:23:55","2004-10-26 01:27:25"
"161","443","42","4","Remember wear factor team program nature hard strategy hit.","","1981-09-24 04:50:34","1982-12-22 02:17:38"
"162","173","97","5","Case hotel court chance civil control type land outside whatever despite subject lay tough.","","1985-06-28 05:48:46","1970-03-25 03:38:38"
"163","292","74","5","List billion scientist others would stand organization will well war local forward resource notice woman.","","1975-11-22 16:15:12","2013-02-24 08:43:34"
"164","107","86","2","Lose soon hundred season economy professor ground debate animal area pass end.","","1978-04-03 21:08:06","1970-07-11 14:01:25"
"165","451","48","5","Either official soon ever statement raise relate really.","","2013-02-02 13:55:27","1987-07-17 22:52:03"
"166","5","3","2","Again hold body power mind either room kind imagine identify manage law.","","1984-10-31 19:34:04","1981-04-21 11:18:18"
"167","199","3","4","Play Mr type this fund shoulder both after stop.","","1991-10-27 08:53:25","2020-08-02 05:11:34"
"168","180","59","3","There off wear though work strategy carry charge also them expect pay old chair leader already.","","2000-01-31 08:51:40","2014-09-02 19:19:07"
"169","196","36","1","Either agreement power sort such dream create offer wonder ten according speak.","","2016-11-22 05:15:32","1988-02-12 15:50:52"
"170","219","9","2","Carry indeed out consumer for go throw write language member prepare morning including theory international read.","","2019-12-01 21:26:59","2005-11-02 19:27:09"
"171","480","77","1","Pressure spring traditional discuss something seek another week close.","","1972-10-13 16:59:14","1977-10-07 22:29:09"
"172","391","71","5","Election first with lose high still water allow theory cell.","","1994-02-07 18:59:35","1976-12-04 02:55:43"
"173","561","14","5","Old fly protect well office wonder follow right.","","2009-08-04 11:59:11","1980-06-16 12:02:09"
