"891","85","7","3","Music computer soldier ball cell industry both our safe rule suddenly join push.","","1986-02-14 20:19:13","1983-04-03 08:03:42"
"892","29","68","3","National property ability fight create standard heavy outside order enjoy.","","2010-07-29 07:05:29","1977-01-22 03:22:08"
"893","316","0","1","Together our market idea out never table pass wall most.","","1973-06-05 11:11:07","2023-06-09 22:43:02"
"894","267","86","4","Test view explain article speak yourself cultural.","","1994-08-21 12:55:36","2012-12-17 07:22:30"
"895","589","76","4","Close campaign medical head by challenge happy represent town feel matter per.","","2023-01-18 10:34:16","1973-11-24 10:50:06"
"896","563","44","3","East make laugh system difference something age conference argue small.","","1975-11-30 20:28:20","2010-11-15 23:55:36"
"897","387","84","1","With southern rate decision bill yes represent truth better full authority usually baby short.","","2012-10-27 05:37:47","1978-03-05 08:57:32"
"898","563","24","5","Quite simple begin his major site agent central rock south event play relationship hot specific.","","1995-08-20 12:11:48","1988-03-22 19:24:41"
"899","69","70","5","Back decision statement over nor computer wind bar number American keep happen stage follow really month.","","2006-02-02 04:58:29","1979-06-17 00:49:45"
"900","196","43","5","Onto together analysis do money student dark.","","2002-01-22 22:16:29","2009-03-18 12:50:59"
"901","94","85","2","Face visit word way loss continue point while concern note subject item general husband trip.","","2000-08-07 15:29:51","2007-11-12 02:34:38"
"902","493","84","5","War campaign campaign however policy environment step choose Republican pay cost however.","","1970-12-07 21:21:21","2015-08-27 17:59:22"
"903","262","54","1","Young exactly thank Mrs face real same seek environment eye marriage bed blood blue born enter.","","2002-06-01 18:07:31","2002-04-05 17:32:19"
"904","166","79","2","Good weight act individual camera senior find suggest local couple once.","","1981-07-03 09:54:59","1977-05-14 03:44:17"
"905","317","39","2","Discussion eat born keep send require it full score somebody left feel owner kid.","","1980-03-02 22:47:45","2017-03-01 23:29:45"
"906","82","70","4","Five somebody consider leader out thing least like actually back front me interview television quite whether.","","2022-02-13 14:46:27","1990-05-21 23:19:10"
"907","177","97","2","Music positive marriage risk skin maintain notice our throughout international image claim look our.","","1994-03-12 15:19:44","2016-09-26 00:10:39"
"908","82","32","2","Appear none own forward financial probably will difficult hope full significant kind middle unit son game.","","1982-02-09 04:00:18","2004-01-21 17:36:19"
"909","178","71","5","Bit morning large development fall somebody control too down site.","","2012-06-27 21:43:40","2004-03-26 12:50:13"
"910","498","40","2","Cold news economy result boy ground example story particular civil thought central I key question list.","","1970-04-03 19:12:55","2024-12-04 09:53:28"
"911","125","88","4","Still decade smile cold recognize responsibility fund late.","","2000-02-07 13:47:19","2015-05-03 05:33:24"
"912","396","13","4","Price newspaper collection realize sit employee chair gas every billion able pass develop contain.","","1986-03-10 00:53:11","1985-08-05 12:07:01"
"913","258","66","4","Fill year reach have news society cause.","","1999-10-14 07:12:06","2019-03-08 11:40:30"
"914","207","50","5","Start consider record agreement budget about sit.","","2001-10-28 09:25:14","1985-06-02 06:18:03"
"915","334","58","1","Kid exist present half lead agent boy use which foreign bank skill.","","2021-01-03 22:50:22","1991-03-27 19:28:28"
"916","597","67","4","Raise leader different unit interesting avoid open not beautiful upon myself performance value keep air.","","1987-02-02 06:47:39","2017-07-14 05:52:19"
"917","544","50","5","Amount safe entire base positive stage measure type rest heart first college line when indeed.","","1984-12-11 13:18:13","1986-06-21 04:45:52"
"918","248","29","5","Between huge ground old list economy different make second church phone.","","1992-12-26 07:38:31","2009-02-05 18:27:47"
"919","459","20","3","Course ready type garden debate nor game experience level provide.","","1974-06-24 23:36:39","1992-06-24 18:48:11"
"920","142","32","2","Level family situation your behind information year determine section particular.","","1979-09-20 15:26:17","1987-10-07 15:31:24"
"921","232","42","3","Water hard left serve run vote leader change nothing attack theory side.","","1992-11-14 05:22:33","1980-02-08 13:43:12"
"922","585","29","1","Clear above recently heart staff hear which south rich small serious another camera.","","2001-05-06 22:52:18","1978-11-02 19:44:17"
"923","51","83","3","Campaign painting nation system home direction threat training his charge trade drive Congress teacher.","","1988-05-21 14:50:23","1989-03-29 10:24:41"
"924","488","48","1","Answer remember individual boy kind teach paper sometimes example increase window instead read prevent relationship.","","1974-07-20 17:51:44","2014-12-14 03:35:11"
"925","38","10","5","Detail near employee value better at fact thank land kid long mouth blue film.","","1972-10-25 22:54:05","2005-03-04 17:01:02"
"926","413","69","5","Show seek become on against bank key movement.","","2022-12-01 23:32:53","2010-10-20 12:55:29"
"927","293","99","2","Play his more spend staff guy next baby finish music deep occur American question member sister.","","1989-12-29 21:46:00","2012-08-15 17:06:35"
"928","551","53","1","Lay late simple ahead discussion mother some.","","2001-03-18 22:39:37","2022-02-20 02:57:54"
"929","588","83","5","Worry lose item myself once Democrat world difference tell as.","","2000-11-29 21:36:00","1981-03-22 18:28:20"
"930","269","22","4","Seven performance police personal couple shoulder claim believe focus become building.","","2014-11-29 09:14:03","2018-09-29 17:38:23"
"931","397","77","2","Hour dark glass understand with believe myself buy.","","1970-12-30 09:18:03","1997-10-04 18:11:31"
"932","38","45","4","Address develop wear drop force class through side politics have pressure serious go her itself.","","2002-04-28 05:37:09","1995-08-30 11:33:45"
"933","125","50","4","Thus less training certain that town wonder.","","2022-11-22 20:10:27","1986-09-06 22:21:52"
"934","563","80","4","Behavior everyone fact especially picture realize bank office democratic upon skin third subject coach.","","1987-03-12 10:04:00","1994-06-25 08:48:41"
"935","77","76","5","Discuss other tell national look last language focus right movement argue cultural you add.","","2008-10-12 07:22:57","1989-03-12 03:42:13"
"936","234","15","2","But financial matter thus send song Republican art.","","2023-09-22 22:59:28","2011-12-25 15:15:48"
"937","258","45","1","View do speak machine art decision figure former significant.","","1983-09-21 22:05:22","1974-07-18 19:11:46"
"938","196","64","2","Painting amount value production thus section sea apply picture artist become than focus yeah.","","1983-03-12 10:58:55","1985-08-08 21:47:26"
"939","77","84","4","Fine consumer character sometimes campaign serve social.","","1970-03-17 10:28:36","1981-09-11 17:30:41"
"940","519","13","3","Approach air loss collection begin nearly themselves avoid take voice.","","2018-11-22 09:40:09","1994-06-02 08:21:45"
"941","408","19","2","Year modern who avoid another bed section hair nothing new help such thus unit board.","","1974-09-28 19:56:17","1970-12-22 07:48:37"
"942","172","29","2","Few visit become edge everybody everyone woman according walk state.","","1977-12-11 22:26:22","1988-12-09 05:35:18"
"943","471","8","2","It minute customer within art stop ground.","","1984-05-18 15:08:39","1998-06-27 06:07:20"
"944","17","34","1","Method effect son senior parent project goal president.","","1984-02-11 00:14:19","1989-05-27 00:07:09"
"945","175","25","5","Third represent ready reality power different nice course PM.","","1992-04-07 07:52:20","2018-12-11 07:31:08"
"946","409","94","1","Evidence street today experience student shake him weight clearly investment hand quite left grow on.","","2022-05-28 01:01:08","1972-01-30 15:08:54"
"947","291","58","4","Compare building air song role student rich.","","1980-07-07 03:47:53","1975-05-30 09:13:39"
"948","570","37","5","Leader his worry make onto along popular site accept such call service.","","2022-01-03 09:57:49","2022-05-21 12:03:49"
"949","457","50","3","Finish summer understand school lose use role.","","1971-06-09 22:51:15","1995-04-24 05:01:08"
"950","17","80","1","Conference community hotel age do night eye give relate bring form no.","","2012-01-17 08:56:45","1973-09-24 14:29:29"
"951","178","16","1","Consider series music make husband worker low simply medical believe tell chance.","","1998-07-29 04:19:22","1979-08-30 23:41:00"
"952","438","1","4","Road station letter person pick happen color energy.","","2003-09-21 15:40:30","1996-08-24 13:10:07"
"953","376","35","4","Program room reality letter program way trouble head remain major.","","2023-10-05 23:17:58","1997-07-09 11:26:30"
"954","135","73","1","Collection population development happen share PM public put recognize physical success likely different.","","2022-12-01 20:10:16","1986-03-22 21:00:13"
"955","68","95","3","Enough yard statement environment ground in investment citizen blood threat responsibility subject heavy machine can.","","2009-05-13 08:10:10","2019-02-09 22:33:32"
"956","333","93","3","Have away since myself simple civil during future.","","2003-02-11 03:28:42","1984-10-25 02:00:12"
"957","443","44","1","Traditional little ask sense food space site size method whatever however thing expert.","","1978-11-25 14:31:13","2008-06-22 11:59:59"
"958","152","94","3","Wish their physical up develop involve likely head despite say street product ask significant understand if.","","1971-01-31 02:14:54","2005-08-12 02:21:33"
"959","527","48","2","Response significant step west water way remain range series attorney process agent fly serious.","","2000-06-12 06:26:07","2014-08-28 03:54:42"
"960","577","40","1","That sure agency build personal until back chair arm.","","1976-11-11 16:10:56","2003-07-27 14:05:35"
"961","72","41","3","Candidate surface line others will evening president analysis back society recognize pick southern large.","","2005-06-28 09:12:57","1974-05-19 07:47:31"
"962","589","42","5","Medical important win real little somebody prepare bring effect well speak.","","1988-04-13 10:02:45","1972-03-30 22:52:42"
"963","542","7","2","He with exactly enjoy staff leave need voice technology wife including four let.","","2018-12-10 07:04:41","2020-09-30 00:18:54"
"964","491","88","4","Floor food building subject two yes although traditional good want why year thousand with.","","2016-09-22 09:19:45","1970-12-22 20:43:49"
"965","213","8","4","East commercial character expect they newspaper really owner number you run argue final effect your listen.","","1975-02-08 05:01:00","1989-12-08 16:13:26"
"966","377","96","3","Magazine air force method product knowledge expect against watch out natural could beautiful.","","1998-10-01 10:36:17","1979-01-16 01:31:01"
"967","379","48","5","Staff voice heart even anyone ground activity everyone long probably stop young dark expert society good.","","2023-07-28 00:57:31","2024-12-21 23:40:26"
"968","219","14","3","Respond everything artist appear American report growth.","","1973-10-26 00:55:05","1976-02-16 10:42:37"
"969","368","2","4","Foreign beautiful coach picture me hard throughout local staff role lead.","","1996-01-12 16:30:31","2011-09-03 15:51:10"
"970","577","35","1","Blue economy lot between business southern allow.","","1991-03-07 07:47:14","1978-07-17 08:55:29"
"971","112","19","4","Where case never space prepare ask push guess others machine phone.","","1996-01-16 03:54:51","1985-10-08 08:36:11"
"972","329","70","2","Position stand much sport project dinner material artist fear carry election never long great positive.","","2004-03-06 20:08:13","1993-10-09 22:30:40"
"973","440","41","3","Guy cover southern avoid worry action before whether direction likely short give especially seem.","","2001-02-13 15:13:53","1996-07-13 02:19:18"
"974","454","22","5","Why air assume husband visit worker hotel its across exactly always mission politics star.","","1976-03-28 22:48:04","1974-10-18 04:54:38"
"975","244","51","4","Over central increase sister PM another fine Mr.","","2007-03-26 23:45:14","2002-09-17 22:34:00"
"976","551","16","2","Several paper wear woman though father sign hand color picture defense few east environment defense month.","","1977-07-07 18:04:42","1983-03-02 11:17:02"
"977","507","20","2","Radio start apply level stand third term religious thing list.","","1973-12-16 09:00:26","2014-09-07 13:29:43"
"978","212","10","2","Way value third sense black include ability election environment do first low.","","2013-04-15 19:30:49","1977-09-10 09:12:32"
"979","214","34","3","Whole old region president magazine number consumer.","","1986-01-11 23:34:46","1989-09-16 00:07:39"
"980","199","41","2","Design especially compare carry chair program whatever it.","","1977-12-29 16:25:03","1996-09-09 07:44:14"
"981","77","43","2","Usually people opportunity radio outside east some economic serve man meeting way common yourself use.","","2004-04-01 01:18:36","2008-10-29 15:39:16"
"982","560","44","5","Discover blood hour quickly item food society next remain.","","2013-11-21 05:04:23","1979-04-20 04:14:18"
"983","587","10","4","Put feeling another decide response purpose several usually admit blue sound health do card.","","1983-08-04 00:10:38","2016-09-12 04:19:42"
"984","38","80","3","Upon require mind middle bad join away only central firm never property score.","","1976-10-29 17:07:46","1977-12-25 02:06:11"
"985","491","18","1","Time see serve best measure thing character list a country.","","1994-10-26 06:29:26","2003-05-08 16:31:40"
"986","294","44","4","Event outside example stock expect bill wrong smile enter result do son admit.","","1987-10-19 19:02:38","2014-11-25 01:02:50"
"987","387","59","3","Ability economic onto prove dog card political institution information guess so state rate mean.","","2019-01-28 01:17:12","2017-12-17 11:48:15"
"988","113","77","1","Generation all indeed against audience necessary campaign indicate middle security financial again.","","2011-09-01 11:48:48","2017-10-22 15:58:45"
"989","457","33","5","Nation rock suddenly end sometimes method challenge process year today him town.","","1994-03-19 05:29:35","2014-03-12 01:36:22"
"990","457","5","5","Be only begin watch yard wrong mention such over.","","1972-07-02 21:21:20","2014-09-07 05:55:34"
"991","88","22","2","Material professional throughout glass lay just kitchen stage scene create method cultural quickly.","","2002-08-02 20:05:37","1991-03-11 01:40:00"
"992","557","85","1","Enter before somebody produce fund as compare someone seek lead improve movement heavy whom.","","2019-11-10 02:48:08","2001-05-13 09:53:01"
"993","250","32","1","Pick skin view age seat word heart.","","2000-03-26 18:19:38","1973-02-22 21:44:46"
"994","215","4","2","Main charge all relate nature local majority bit adult course third.","","1977-10-13 07:58:51","1995-10-30 14:47:27"
"995","475","66","2","Cover everybody east next write financial character option individual.","","2014-04-29 19:29:39","1984-01-29 01:36:22"
"996","37","91","4","Interest human win but what type relationship game state pretty.","","1979-07-12 17:09:08","2012-03-18 00:40:40"
"997","557","12","4","Themselves party information million building score above night white field my process.","","1976-12-29 12:45:37","1971-02-12 15:05:32"
"998","572","38","3","Agreement toward morning thus any lose reveal under she think involve bit inside arm.","","2018-04-01 07:43:01","1990-04-09 04:36:38"
"999","107","73","2","Contain involve party stand matter where man.","","2022-08-20 03:04:02","1997-11-26 07:00:17"
"1000","408","85","1","Enough material front live medical pull although.","","1991-06-23 04:55:16","2011-09-17 21:59:35"
"1001","356","59","4","Political design start television address occur already product election building yard.","","2009-12-14 22:14:11","2018-06-26 16:56:21"
"1002","440","57","2","Actually response before word once offer to second method party international south cover customer.","","1988-02-05 15:41:19","2014-08-16 07:25:26"
"1003","454","81","1","Voice two mind own public state modern national attorney baby.","","2014-04-28 04:49:37","2021-09-18 11:45:24"
"1004","514","52","3","Store home story serve believe development great break out break but others.","","2016-08-17 11:54:17","1992-10-05 08:30:43"
"1005","301","28","4","Certainly table economic film purpose difference color ball.","","2001-05-21 20:08:22","2014-10-22 13:48:50"
"1006","368","52","5","Them two different shoulder culture way laugh style anyone authority difficult economic determine.","","2002-09-24 08:04:50","1985-11-18 12:09:35"
"1007","213","97","4","Tough material often dream need perhaps authority although total yeah other.","","1981-04-18 09:20:41","2018-11-24 22:40:01"
"1008","204","46","3","Hot exactly bit lot response provide million it create seem address.","","2018-07-24 05:03:39","2013-01-02 04:50:54"
"1009","368","71","1","Company hit possible paper because serious perform cultural per note.","","2019-04-13 03:05:56","1985-05-06 01:27:32"
"1010","475","41","4","At us popular soldier both fact store amount economic face level me.","","2014-09-13 15:52:26","2014-08-13 23:59:25"
"1011","281","43","4","Security walk show window green suffer friend soldier material work.","","2022-05-29 04:52:22","2012-12-26 04:05:26"
"1012","256","63","1","Something young piece include drop true prepare but.","","2018-12-04 05:35:47","1992-07-25 01:23:38"
"1013","369","76","4","Why group her at a artist career through accept recently community federal experience one.","","2005-08-20 20:04:17","1993-06-08 01:41:38"
"1014","261","57","3","Receive fund yard fight food we cause.","","1984-06-20 21:34:36","1973-12-22 20:10:33"
"1015","233","4","4","Political executive speak arrive ready yard political catch social believe.","","2010-01-31 01:28:46","2016-03-18 00:39:50"
"1016","273","100","3","Institution interest fly only smile bed pattern lose film my so avoid official tax if.","","1989-05-25 19:03:01","1976-04-25 22:18:29"
"1017","199","97","3","Land hand size million force fish whose here.","","1981-10-31 11:14:38","2020-05-12 04:30:24"
"1018","295","78","3","Discussion beautiful be bill business environment everything history glass research explain everything why as.","","1977-04-21 17:00:35","2009-08-09 06:44:23"
"1019","570","23","3","Source author blood modern coach truth center west office power shake watch enough human.","","2019-05-11 18:26:55","2009-06-15 20:08:49"
"1020","308","96","5","Material article year mention deal check right each allow purpose school help win.","","2011-11-30 14:55:35","2009-10-28 15:11:52"
"1021","250","12","3","Worker decade fund window Republican for voice officer throw not issue process huge shoulder tax.","","1973-10-10 18:38:41","1981-12-22 11:06:05"
"1022","244","60","4","Serve upon foot kind move service draw personal building window happy almost.","","2005-11-30 08:05:02","1981-03-26 16:39:57"
"1023","329","69","3","Walk guess stage these agent election citizen director film provide us finish serious.","","1991-01-17 14:32:13","2009-03-27 10:42:05"
"1024","174","68","5","Alone several score loss also enjoy have during tell avoid opportunity rate.","","1998-01-31 07:20:16","1978-11-09 08:43:42"
"1025","378","10","3","Difficult common heavy among or face artist ask mention party surface building particularly green hair.","","2003-07-14 22:11:06","1983-01-27 01:50:03"
"1026","359","30","3","Push plant little act well take campaign pass.","","1978-01-19 15:34:15","1997-12-05 07:51:18"
"1027","271","1","5","Sometimes citizen fast professional kitchen policy ground.","","1976-03-01 23:40:24","1974-06-08 19:05:23"
"1028","40","70","5","System production have size window begin benefit second whether left social.","","2025-03-03 15:56:01","2019-07-01 11:50:49"
"1029","375","20","5","Space its ask themselves very with cultural rule serious entire work yes.","","2005-05-06 06:20:57","1985-02-26 11:53:20"
"1030","459","61","1","Continue benefit just better allow court bring case.","","1976-04-17 14:18:48","2022-07-25 00:43:20"
"1031","598","46","2","Arm for member lawyer two seem somebody but we walk term.","","2007-08-24 23:33:15","1983-08-07 00:54:15"
"1032","333","55","4","Drive expect authority seem other continue political recognize he me anything.","","1974-02-26 12:19:04","1979-09-20 04:02:55"
"1033","544","3","4","Various force nation factor include social room next agreement issue although matter.","","2011-08-17 02:52:49","1977-05-02 09:48:31"
"1034","433","28","5","Family practice because opportunity nation thing floor history another always serve current see stuff coach pay.","","2004-11-12 19:42:40","2005-08-18 08:09:25"
"1035","18","52","2","Participant simply American point movement ready woman experience write although your author treat.","","2006-03-29 21:46:23","1985-10-02 22:59:30"
"1036","552","10","1","According degree turn week chance commercial cut since important agency exactly east energy ahead.","","2014-09-06 12:44:01","2017-08-14 04:19:32"
"1037","528","58","3","Development subject agent author seven exist top hear perhaps peace meet in site.","","1986-01-25 06:54:54","2009-03-18 04:13:35"
"1038","494","84","1","Lay impact bring road quite those during head so degree clear clearly near risk find.","","1979-09-07 06:40:56","2001-10-30 09:21:48"
"1039","528","30","5","These yes one member chance sign manager special develop evidence parent avoid.","","1990-09-14 02:25:10","1982-05-03 14:20:15"
"1040","213","11","3","Less grow current adult move either stay economic offer firm last.","","2011-12-10 12:53:13","1979-05-14 01:30:36"
"1041","146","61","1","Huge moment road generation trade consider add.","","1972-06-03 00:26:43","1978-05-28 22:19:58"
"1042","207","47","4","Program you everyone adult page series fact tend she evidence prepare.","","1985-03-22 01:20:40","2017-10-11 11:49:01"
"1043","572","26","3","Training Democrat brother back white live alone hotel else us experience resource major while idea.","","2022-06-08 09:58:21","1997-03-30 03:07:19"
"1044","496","94","1","There situation rise heart picture religious among total serve control glass.","","1993-12-18 03:22:24","1971-07-03 04:30:26"
"1045","514","77","5","Per knowledge radio civil read again lawyer no area turn itself.","","2010-12-13 09:07:31","1985-01-09 20:32:26"
"1046","226","74","3","Mother hair young house sister benefit professor.","","1971-02-02 23:16:13","1985-09-15 07:29:03"
"1047","37","73","2","Trouble system suffer likely change class develop big up amount.","","2002-03-17 05:49:51","2014-02-23 22:37:20"
"1048","299","15","4","Program yourself reveal moment top beat data itself produce receive receive including he too.","","2015-04-12 13:49:24","2004-08-19 00:57:20"
"1049","184","30","5","Carry stop represent either a ago whose ahead.","","1981-04-20 16:36:03","1987-12-14 03:18:06"
"1050","108","5","2","Meet treatment share party understand support meeting various study story.","","1988-01-24 19:28:38","1990-07-07 15:23:18"
"1051","141","79","1","Middle really hand trade follow toward already bar result good reveal career.","","1982-12-11 12:34:43","1993-12-03 07:13:42"
"1052","233","25","5","Of agency off result nearly beat should model wall chair kind structure method fact term.","","1980-12-02 22:10:12","2005-10-22 15:09:35"
"1053","385","1","4","Risk line number read particularly safe sing wonder family also mission hit think.","","1999-12-10 17:10:06","2023-03-23 23:48:59"
"1054","488","54","2","Fly million body event less any ability stop then TV win party catch medical serious mean.","","1971-09-25 17:42:11","1972-11-12 04:48:49"
"1055","464","23","5","Community write old any radio evidence popular method general.","","2018-05-11 16:50:17","2007-10-23 23:26:14"
"1056","505","79","2","Generation exist from easy major help very.","","1996-04-30 04:09:26","2018-05-10 05:17:03"
"1057","359","26","5","Congress foot total interesting two choice score Republican even audience.","","1999-11-14 21:20:33","1981-03-30 01:55:40"
"1058","267","59","3","Old training condition read billion responsibility walk provide speech party put sing mention technology.","","1974-04-26 21:08:10","1982-03-06 01:29:38"
"1059","226","36","4","Live run check film whom center recent travel trouble ability.","","1988-06-30 19:57:22","2010-04-21 01:51:24"
"1060","341","77","1","Cup operation somebody white within appear ever nice church become environmental thus brother suffer.","","1979-01-02 20:03:49","2010-11-29 15:27:17"
"1061","527","68","5","Throw first same kid make five others but onto entire popular carry office.","","2013-07-21 19:37:16","1973-01-15 17:32:28"
"1062","516","59","5","World chance civil everyone we central soldier home recognize drop different TV rise society.","","2017-11-10 15:08:08","2014-02-19 17:24:13"
"1063","540","59","2","Inside bill last image enjoy report strong.","","2010-08-13 16:02:59","1986-10-14 21:44:19"
"1064","551","71","4","Room central college above go environmental mother.","","1989-05-23 05:04:00","2020-06-12 14:49:17"
"1065","213","56","4","Enter family base poor guess indicate push form issue professor work my not police actually tonight.","","1975-05-18 13:37:52","2019-06-15 04:58:52"
"1066","106","94","3","Anyone fish treatment this while when prove act theory.","","1975-05-18 07:16:49","1992-03-13 20:26:03"
