"0","30","72","4","Stay open social weight property provide job look cultural remain authority.","","2002-08-22 21:09:35","1982-04-07 14:48:49"
"1","25","31","4","Not kid understand force attorney car next war agent sometimes human.","","1993-05-21 16:19:38","2006-09-05 22:33:47"
"2","58","36","5","Team all determine standard effect piece state.","","2024-01-28 22:48:09","2012-01-01 21:31:04"
"3","19","90","2","Require turn commercial sense effort back thus everybody cost ahead.","","2019-01-16 06:31:07","2007-07-09 11:47:54"
"4","35","10","4","Head cut century world fill serious ground cover.","","1993-02-21 07:38:32","1978-12-15 18:39:40"
"5","88","89","2","Them commercial field perhaps sit put check data foot son.","","2008-02-13 18:37:58","1976-09-17 21:53:56"
"6","73","34","3","Source culture space standard compare law note big live state room show significant right stock industry.","","2001-05-01 20:58:28","1995-01-14 10:19:09"
"7","82","81","1","Loss suffer agency book attorney environment couple way animal size increase unit without western shoulder bring.","","2009-03-06 23:12:48","2022-08-02 23:56:41"
"8","65","27","4","Current cell feel catch rise bit current coach admit stock worry its unit see state any.","","2013-02-28 06:44:52","1993-08-12 23:57:03"
"9","16","82","3","Tend fact ask your opportunity plan billion language conference wife opportunity learn on lawyer.","","2010-04-13 03:02:01","1993-01-13 13:33:45"
"10","7","5","1","Buy mean relate put indicate administration indeed.","","1994-02-12 23:24:10","2023-04-22 02:44:31"
"11","6","5","3","Theory including food off democratic argue after series fall.","","1988-12-25 03:18:44","1993-02-27 16:38:40"
"12","71","58","3","Southern writer animal recent page explain follow season well population perhaps their top care look.","","2023-10-10 14:59:51","2022-12-09 19:02:23"
"13","7","96","2","Difficult anyone consider around defense way include want idea place customer allow certainly by.","","1983-05-06 02:04:47","2000-07-16 23:28:24"
"14","48","23","2","Save box clearly level arm miss military.","","1991-01-06 22:12:49","1976-12-04 01:28:45"
"15","42","34","3","Discuss later manager population central knowledge morning foot business environment compare develop.","","1993-08-04 22:44:41","1996-05-14 19:39:43"
"16","24","22","2","Course general with provide must prove bad test dream.","","2023-08-10 18:25:58","1980-06-27 12:34:02"
"17","44","31","2","Cover visit understand bit bill education admit visit smile forward.","","2006-01-08 15:44:19","1991-02-12 13:51:10"
"18","43","17","2","Which level name have world either us.","","2017-08-04 13:52:30","1984-02-17 11:44:47"
"19","35","95","2","Week condition place teach save current future skin financial woman they several.","","1995-03-19 09:09:29","1996-12-12 02:26:25"
"20","90","1","3","Answer color want possible keep crime Republican.","","2021-03-25 20:58:52","2010-08-04 12:06:48"
"21","43","80","5","Strong among financial table anything ball than along those rest.","","1985-12-26 09:34:07","1995-07-06 07:20:47"
"22","87","47","5","Or for prevent new parent stock someone where remain again.","","2020-06-24 14:51:03","2005-03-06 06:40:36"
"23","95","25","3","Election purpose though friend population notice series them film choose second return because together color.","","2024-10-08 09:46:52","1970-06-26 21:51:15"
"24","50","54","4","Simple lay voice medical travel of quickly notice.","","2000-05-29 08:20:23","2000-08-17 01:49:05"
"25","46","14","3","Peace out call western machine risk painting myself out across final include prepare kind.","","1984-12-19 10:27:40","1971-08-02 11:57:06"
"26","40","26","1","Any child I account personal back short resource as national treatment teach chance leave project.","","2023-08-21 09:37:32","1991-12-19 14:05:56"
"27","83","15","3","Modern beyond issue tend tend allow account yard student network.","","2007-06-29 23:23:08","1987-12-03 06:43:39"
"28","90","66","5","Shake someone kind best new director world three it full drop week.","","2009-10-09 21:27:28","2024-02-11 08:34:09"
"29","25","87","1","Item energy weight successful somebody learn face teach participant feel rather daughter officer operation pretty address.","","1982-06-13 03:43:32","1972-02-18 21:29:29"
"30","60","6","4","Something form travel democratic they accept seven court sense very agency shake article Republican.","","1977-11-13 04:41:51","2007-10-31 22:59:35"
"31","76","7","5","Third artist upon down including practice set happy person agency.","","2000-02-22 15:18:03","1987-03-06 03:34:02"
"32","66","26","4","Despite yet ability reflect mean soldier fill.","","1996-12-07 16:41:41","1976-06-17 06:26:02"
"33","32","7","5","Inside open remember you investment one next baby hope class like remain increase environmental.","","2019-07-12 18:23:26","2018-12-04 04:24:07"
"34","73","46","3","Agent them especially guess special year follow there small first local student.","","1993-10-19 09:36:55","1981-03-27 17:48:17"
"35","33","3","5","Something president resource spring national ahead true free hard hour onto position notice cover.","","2003-09-15 07:22:05","1986-09-30 10:27:31"
"36","8","98","2","Image fund sort relationship Mrs record whom place usually consider rock foreign.","","2023-04-19 06:31:35","1991-08-08 21:25:43"
"37","30","19","5","Per sell action hope than major street discover choice.","","2010-08-31 15:52:32","2015-09-18 15:18:40"
"38","55","86","1","Mr offer read teach window skill must before true structure condition.","","1975-09-13 16:50:36","1998-10-09 12:54:08"
"39","11","95","5","Pay but like art modern contain him toward door group should stock still describe cost.","","2005-10-18 11:58:03","1990-01-03 16:22:34"
"40","62","39","3","Eat will various eat claim discuss box player outside anyone for will green design choice house.","","2003-05-31 21:35:28","1975-07-14 14:16:42"
"41","49","43","4","Research travel fly need their think picture sure keep meeting.","","1996-01-21 09:39:09","1996-05-06 11:59:44"
"42","89","63","1","Catch admit industry social discussion forget leave help according see situation leg central other offer.","","1978-06-12 05:19:55","2002-02-02 17:54:11"
"43","58","14","5","Unit enter of quickly too view house find TV light exactly.","","2010-11-29 03:34:27","1977-04-10 17:54:53"
"44","91","84","3","Ago fear develop central crime design concern employee father five.","","2017-07-16 11:52:22","1986-09-04 19:16:20"
"45","99","11","4","My build make career attack hit teach wall son bag form guess model.","","1980-02-20 08:20:08","1998-07-23 17:25:44"
"46","94","99","4","Out ask radio series successful back part.","","2006-12-15 16:59:50","1974-06-28 19:54:07"
"47","48","39","1","Computer sort spring present billion act against conference tree store everyone idea finally over impact short.","","1997-05-24 18:07:28","1979-12-01 00:00:38"
"48","81","56","3","Experience right every hand major would table why agree herself question lawyer think.","","2017-11-17 19:51:29","2011-04-10 18:57:35"
"49","60","77","4","Local weight success property head get million along oil daughter human person election create word behavior.","","1987-05-07 06:06:14","1998-07-16 19:28:54"
"50","33","37","2","Morning again very cause radio find push PM role participant.","","1994-01-27 10:34:00","2015-08-18 23:44:56"
"51","21","87","5","Near summer establish to dog full certainly small me.","","2002-03-01 04:24:40","2013-08-10 14:00:26"
"52","71","49","2","Prepare job character focus it before available may listen able respond worry sit.","","1993-01-10 18:05:21","2003-02-10 02:54:39"
"53","67","11","3","Find alone six reach face set each.","","1983-03-14 04:18:27","2015-11-20 08:28:49"
"54","18","94","4","Agent find pay hit four care actually their international wrong interest.","","2009-01-19 20:26:37","2007-11-11 15:41:13"
"55","1","21","2","Possible against these goal party son million well low human break note return instead.","","2006-11-04 21:54:14","2001-11-22 07:43:57"
"56","36","27","1","Born site three nature these share respond upon.","","1982-06-08 19:24:39","1990-08-18 06:25:18"
"57","83","41","2","Democratic walk movie fish parent those car already travel water customer walk light fire.","","1999-08-07 00:15:32","1975-05-02 10:56:38"
"58","35","37","4","Check worker similar he industry cultural nature ball exactly manage small.","","1992-10-25 14:19:41","1973-06-19 16:14:15"
"59","45","28","4","Save yard pick your bar choice window enjoy national trial at cover see where.","","2008-08-21 15:07:59","1977-10-03 00:35:47"
"60","41","19","5","Lay Democrat color difference need remember among kind boy avoid offer executive responsibility surface wind.","","2015-06-28 23:08:09","1997-01-22 09:17:44"
"61","18","20","1","Administration your present real listen tell upon couple more change any fish work consider.","","2006-01-24 16:52:00","1980-03-23 15:01:47"
"62","99","62","1","Second I ago past put blue toward along energy war.","","2012-09-20 22:23:00","1993-10-04 19:27:02"
"63","59","1","4","Firm unit Republican get campaign step beautiful first stand stuff her majority majority often participant however.","","1989-07-12 05:37:50","2007-07-15 05:55:12"
"64","96","56","1","Source hit company occur former until friend rise.","","2013-01-15 03:29:16","1998-09-09 20:50:24"
"65","84","52","3","Prove method network every later stuff quickly girl.","","2008-06-22 20:20:47","1992-01-08 09:10:18"
"66","40","3","4","Would seek investment since or personal reveal particular these fall safe red year.","","2006-10-03 06:37:49","2004-01-22 19:55:40"
"67","71","34","1","Company a north not option gas maintain chair professional.","","2024-01-02 12:09:39","1984-12-28 03:29:34"
"68","85","57","2","Factor establish central vote democratic those none community economic writer politics service.","","1998-11-24 14:27:02","1983-07-15 00:36:12"
"69","79","9","1","Include situation morning college finish successful ground.","","1998-06-18 23:24:13","2023-06-19 17:50:26"
"70","67","82","3","Product likely because media owner together plant home keep interview next most probably six whose item.","","2020-06-14 12:54:12","2025-04-04 21:17:32"
"71","58","10","5","Civil mind system subject customer able table.","","1986-07-18 11:18:14","2024-09-20 00:21:27"
"72","52","79","5","Street suggest measure coach plan son almost tree radio value drop child yes new compare deep.","","2020-10-10 23:11:40","2005-06-12 18:02:24"
"73","65","21","5","Nature start subject provide subject issue drive remain.","","1991-03-13 23:28:51","1983-10-27 22:57:25"
"74","9","59","2","Week defense later spend follow national this like significant church across couple one.","","1977-12-14 12:06:28","1981-12-04 08:04:48"
"75","9","54","5","Old concern activity medical deal thousand leg current wait structure main force Republican hold majority.","","1979-12-16 18:22:47","1990-04-18 00:34:49"
"76","49","12","3","Trade respond real civil suggest woman send to each father southern.","","1988-02-08 16:32:39","2021-05-05 15:16:20"
"77","51","52","5","Former consumer provide mind likely later later among power director.","","1987-12-03 12:55:32","1979-10-10 16:45:51"
"78","53","58","5","Require player sense region yeah we shake strong reality.","","2019-04-16 09:44:54","2019-03-25 13:08:55"
"79","93","4","2","Sign usually control pay provide TV heart family.","","2011-05-06 14:24:14","1977-01-10 17:33:59"
"80","77","76","2","Notice let explain thousand ahead his policy goal something sure talk side recent life reality.","","2013-03-16 03:41:54","2011-11-27 03:24:27"
"81","32","20","3","Shake truth your she theory manage finally magazine administration own your Congress program.","","2016-01-02 07:57:17","1991-07-26 00:59:34"
"82","18","35","4","Dark ground former anyone coach look if condition.","","2013-01-03 19:57:52","2011-11-30 15:57:21"
"83","39","68","1","Whole into spend half produce rest while course safe foreign the green go term thousand a.","","1988-10-17 20:42:35","1990-10-10 06:10:34"
"84","17","28","2","Spring woman least process fact two movie whose couple material model face medical today ground.","","2011-06-29 17:24:37","1978-01-08 09:55:50"
"85","69","83","1","As explain foreign green weight actually institution skin sound not myself good blue lead.","","2000-04-01 02:07:27","2024-03-22 02:01:22"
"86","63","33","1","Painting available pick democratic class commercial kitchen least recognize base.","","1988-10-20 19:06:12","1989-08-06 16:07:10"
"87","63","76","3","President continue resource popular baby those high you human wife administration tend.","","1987-04-04 00:18:57","1986-01-07 16:45:15"
"88","74","42","3","Generation task stuff will road exist sister guess nor individual thing around agency along prepare day.","","1972-01-03 06:21:56","2009-05-31 13:34:30"
"89","34","87","1","Administration whatever improve many positive effect entire message.","","2014-11-14 00:04:44","2006-09-08 20:00:24"
"90","76","90","5","Job goal show food bank especially say Mr collection less science attention me.","","1995-12-05 03:28:29","1983-05-12 04:49:50"
"91","89","9","3","International member build be onto form fire arrive resource need experience radio modern.","","1999-05-30 00:24:10","2020-02-26 20:39:26"
"92","36","79","5","Though Mrs phone ability pretty cost center data billion last leg.","","1977-08-07 23:42:14","2002-01-31 22:11:07"
"93","62","37","1","Think line husband begin determine special method color check per test property black since then.","","2025-04-19 09:45:43","1989-04-02 09:37:52"
"94","22","35","2","Energy purpose then may heart news dark cold situation.","","2017-04-18 23:38:53","1971-12-16 08:22:11"
"95","88","34","1","Accept leg particularly laugh fund force activity hospital school eat mind buy.","","2012-05-21 06:54:37","2015-11-04 09:40:11"
"96","42","37","2","Leave lay for information anything American those bit history.","","2018-01-17 07:43:33","1980-12-07 20:40:26"
"97","56","5","4","Follow cup rise participant control top involve charge eight then final air letter.","","2013-12-11 04:31:55","1994-08-05 21:36:54"
"98","68","31","4","Half easy best challenge defense law involve animal nation.","","2023-09-01 07:17:28","2003-06-09 09:52:07"
"99","15","35","1","Message quickly administration star animal sing direction respond method training mind out kitchen.","","1998-07-02 22:25:14","2020-05-07 14:09:17"
"100","46","39","4","Better soldier know memory money evidence peace human.","","1987-11-02 00:26:19","1983-10-20 09:44:10"
"101","92","28","5","Career situation marriage rate she image mission perhaps meeting point which assume space someone.","","2013-02-06 16:03:45","1985-10-07 18:28:32"
"102","47","8","4","Record environmental cup red prepare statement lawyer film knowledge character energy.","","2017-07-01 20:14:07","1998-06-03 17:09:31"
"103","99","27","1","Really production church decide price son budget light today act Congress itself know buy.","","1993-02-15 03:40:51","1992-01-01 11:44:03"
"104","96","7","3","Language stock break hit everybody well campaign skin sing occur explain young cultural friend ahead foot.","","2001-03-27 13:06:53","1998-03-06 03:20:04"
"105","75","37","4","Produce become father get hair TV hair word whose.","","1993-08-19 04:45:30","1990-01-06 04:58:47"
"106","3","30","4","Military reason garden foot president study stage still soon.","","1986-10-21 23:31:23","1992-06-26 10:10:26"
"107","62","10","3","Successful fill senior everyone here everybody election.","","2019-01-29 14:41:29","1995-05-02 12:40:53"
"108","79","92","1","Travel alone throw hand car account wind sense town career Republican church reflect remain.","","1973-08-10 05:28:15","1975-07-04 22:45:51"
"109","98","52","5","Trouble heart than page floor vote parent society up.","","1976-05-27 12:04:10","1975-08-29 18:02:43"
"110","14","80","2","Arrive usually into start imagine player financial her value should.","","2015-04-26 02:24:31","1983-03-06 22:35:09"
"111","18","79","1","Think against five early behavior tough east less life hold hope the wait general item she.","","1998-02-19 05:05:19","2019-07-23 21:28:30"
"112","3","71","3","Brother realize process wide course style edge catch measure mean certainly movement attention director fund.","","2005-01-02 02:11:51","2017-12-27 12:10:46"
"113","55","32","2","Identify car nothing allow although other future spring upon social side relationship.","","1993-02-14 01:12:26","2004-06-15 08:20:08"
"114","3","58","5","Better a expert born identify just member resource manager throughout eight challenge mind beat.","","1998-01-07 16:04:12","2015-09-25 12:04:07"
"115","87","5","3","Arm fill spring town list white material moment happy sit action such.","","2013-02-04 15:20:15","2009-11-02 17:18:32"
"116","23","22","2","Again movie although college start return marriage window economy word manager national play next response.","","1973-09-03 05:39:16","1972-06-22 22:41:14"
"117","84","1","5","Heart heart could world western chance mission fill necessary hit during add contain quite.","","1971-01-12 23:29:03","1979-10-07 11:27:55"
"118","73","6","3","School black government available hotel glass race.","","1999-12-24 14:33:25","1982-12-11 13:58:23"
"119","55","80","3","Education away I inside eat need near behind current discussion early.","","1979-05-03 21:09:43","1985-01-05 16:33:55"
"120","45","64","3","Audience carry term still building treat these stay house.","","1976-10-02 17:32:42","1984-07-10 08:49:34"
"121","92","6","5","Example art tough management must if human human begin development direction.","","2009-05-22 17:37:44","1992-09-02 18:16:48"
"122","37","71","2","Huge information agree kind decide remain argue lose.","","1988-04-03 17:48:20","2009-04-24 01:34:26"
"123","2","80","4","System easy blue debate job activity rest oil high.","","2000-09-01 20:08:06","1988-11-15 12:55:29"
"124","6","93","1","Provide beyond matter organization resource watch after sort local rich soldier gun sign.","","2004-03-02 04:42:04","2005-07-18 01:14:48"
"125","29","88","1","Nearly tonight return contain glass school its buy later mouth blue dog through.","","2011-04-08 05:47:20","1989-05-23 16:19:42"
"126","28","32","2","Source fight tend knowledge career maintain purpose seek.","","1980-09-24 09:37:50","2020-11-02 19:11:33"
"127","81","46","1","They civil strategy citizen something a meet something reflect network keep major much keep.","","1999-11-30 07:22:25","1994-04-05 23:52:10"
"128","56","15","3","Box serious science east present country apply public must vote prepare exactly.","","2004-04-30 17:34:48","2010-03-15 21:33:45"
"129","44","49","3","South low just fine avoid technology low at into feeling ago.","","1984-06-12 18:58:11","2013-12-18 21:26:33"
"130","7","14","4","Sea score many important focus real perform win say agency upon write current set machine down.","","2006-11-29 15:45:07","1985-08-16 03:45:52"
"131","92","48","1","Build whom let ten level case minute culture east yeah group news account among.","","1992-04-19 12:40:10","1987-05-18 14:23:04"
"132","37","42","5","Police million floor treat design heart energy.","","1979-01-16 08:09:38","1978-11-08 14:38:51"
"133","76","20","2","True significant need win forget color significant truth executive I into discover other.","","1999-03-24 21:49:21","2000-11-04 17:16:55"
"134","0","57","5","Role spring son sure nature hit nothing how teach write again actually base picture.","","1985-02-06 17:56:24","1993-12-08 19:41:02"
"135","93","20","5","Expert time available church base one once message form throughout actually product.","","2024-05-17 14:56:08","1976-02-03 05:08:37"
"136","82","35","3","Window exactly maintain issue they make whatever indeed on commercial under discover between through kind.","","1999-07-03 20:44:49","2002-10-06 13:01:26"
"137","27","97","4","Fast mouth human they might challenge process into hope impact wind side official hear majority.","","2002-05-04 12:08:03","1986-04-07 23:02:14"
"138","88","24","4","Black cultural experience sign pull pick middle gun price peace.","","1987-07-11 08:49:59","2021-06-30 09:55:23"
"139","46","45","1","Thousand within through station step alone loss police account window drug have.","","1993-02-26 00:29:06","1974-08-28 23:07:54"
"140","70","36","4","Understand anything quickly might section top success education behavior early than sort one value cut.","","2008-09-25 07:10:16","1974-10-02 10:56:01"
"141","49","69","1","Discuss PM force read dog many whatever.","","1974-12-14 14:00:12","1975-04-28 17:29:42"
"142","16","53","4","Nor church thought lead travel whatever describe police level example.","","1978-12-25 12:43:32","1988-03-03 01:30:03"
"143","57","9","4","Whose western radio light activity see beyond easy phone board because receive raise several.","","1982-07-26 16:26:09","1998-06-08 21:55:21"
"144","66","76","1","Down their after usually history recent who carry area style.","","2016-11-29 21:08:04","1979-09-03 18:43:01"
"145","3","38","5","Conference involve miss degree close production interesting fly.","","1998-02-13 13:15:32","1982-10-27 00:57:16"
"146","92","70","5","Everyone despite model environmental possible window least show information scientist Mr treat as particular decision alone.","","2009-10-16 10:05:30","1974-11-30 05:00:13"
"147","95","89","1","Company million get south culture cell high person family.","","1993-08-10 23:38:49","2013-05-20 18:48:49"
"148","69","28","3","Sing current few name energy east policy pretty business off hair big shoulder.","","2020-02-21 02:34:37","2015-06-04 20:29:51"
"149","63","17","1","Television couple seem medical sign movie course reality other image apply peace ahead past large.","","1995-11-18 11:54:07","2001-05-13 06:10:19"
"150","59","4","4","Magazine often future finish these so onto speak establish short.","","1997-12-26 23:39:46","1984-07-05 22:12:40"
"151","36","93","3","Develop without travel discuss trip enough detail worker officer effect green term sister.","","1995-06-18 05:16:46","1994-07-19 08:01:54"
"152","6","89","5","Scene page least explain education seem number.","","2021-04-05 08:14:54","1998-11-30 05:16:28"
"153","83","78","3","Painting center when role price include season full wish society same land send night sound.","","1988-06-22 17:57:16","2003-06-09 19:31:13"
"154","5","2","2","Door focus line late scientist matter young society role news key argue realize draw.","","2012-06-02 09:19:00","2008-04-25 06:34:42"
"155","35","73","2","Catch garden once item dream today figure give animal rate.","","1995-07-03 12:27:57","2005-06-18 14:03:14"
"156","23","0","1","Lose change should message owner weight perform leader tough such her person.","","1986-01-15 20:36:27","1976-03-05 01:32:48"
"157","62","59","5","Office bar head manage many industry south song nothing admit fact.","","2009-02-23 01:57:40","1998-10-05 17:08:17"
"158","24","61","4","Check effort case environment project despite onto turn.","","1992-05-23 10:20:48","2005-10-03 23:42:03"
"159","3","39","3","Star off office view hope year suggest go development also task enjoy accept head role.","","1997-01-30 17:14:58","2009-03-10 16:24:49"
"160","89","96","4","Military become down hair capital popular gun table local mind exist system wish stand.","","1988-10-04 19:34:31","2016-09-13 18:37:09"
"161","0","29","2","Class price simple stuff determine responsibility conference better approach determine his baby person.","","1984-01-02 12:17:39","2003-09-15 23:45:36"
"162","43","18","1","Pressure long your those able season cup part carry cause serve drop.","","2022-12-20 04:35:21","1994-11-09 16:52:17"
"163","89","17","3","Look under give hour analysis price offer surface.","","2000-07-26 04:28:07","1994-08-24 13:52:32"
"164","44","87","3","Natural best western sure show conference industry.","","1970-10-29 21:12:00","1990-05-28 00:47:32"
"165","18","92","1","Class produce plant read wait claim hotel politics prepare draw able source open human budget civil.","","1980-10-21 21:59:25","2010-11-18 16:29:03"
"166","72","9","4","System child there character three but debate beyond service expect past sport stuff.","","1983-02-16 12:43:08","2012-04-22 00:40:16"
"167","92","51","3","Life commercial shoulder news history begin drug.","","1982-04-26 02:47:38","1979-12-21 00:01:50"
"168","58","21","3","Take drug drug eat red sure general field human we.","","2005-05-11 11:42:13","1992-04-24 02:40:40"
"169","46","24","5","Land class own learn either magazine senior especially.","","1990-04-13 15:47:08","2001-04-29 00:35:12"
"170","89","25","5","Onto throughout shoulder teacher suggest help meeting coach probably drug which tough physical during mouth suggest.","","1978-07-10 19:11:59","1990-08-01 11:13:30"
"171","90","73","2","Side our case animal space call work arrive audience someone according letter.","","2021-03-25 16:24:44","1982-05-29 09:32:29"
"172","67","57","2","Weight PM room also wonder mean office into.","","1976-07-22 17:58:00","1975-11-01 06:25:25"
"173","19","66","3","Trip argue bill citizen kind view much own.","","2002-09-12 07:26:12","2012-09-16 10:35:28"
"174","25","52","3","Alone suffer require ask your stop cultural kind same better thing page town idea.","","2018-04-01 23:52:33","1983-12-13 07:46:11"
"175","46","42","5","Herself class administration piece water even country down wall.","","1975-11-26 09:16:55","1982-07-07 16:45:06"
"176","19","28","5","School short that director five ask thousand understand discuss expect.","","1980-03-18 10:13:22","2003-05-09 10:36:42"
"177","63","9","5","Cultural fear hour kid today Mr at public tell life early movie tree.","","2011-11-06 07:11:50","2002-04-15 10:34:42"
"178","86","59","2","Here system outside one week trade before product wide little begin management reveal fill smile.","","2002-07-27 18:59:03","1981-02-06 07:34:48"
