"179","23","60","4","Itself language appear ball move blood data action old.","","2018-06-19 02:02:28","1999-05-31 02:30:28"
"180","45","82","3","Reflect sport day day box speech either country issue all.","","2016-08-07 11:51:47","1999-08-01 12:53:50"
"181","83","16","2","Hour loss still during analysis raise six training change reach myself notice vote.","","1991-03-25 14:16:39","1992-11-28 04:00:29"
"182","75","19","1","Level account door skin company history develop center can available poor process.","","2006-07-31 15:06:46","1992-11-18 00:55:22"
"183","38","85","4","Congress tend official happy over market any fire machine.","","1987-08-12 00:20:11","1997-10-20 22:09:01"
"184","78","91","2","Record old body effect itself personal college body could morning start.","","1978-07-28 08:38:24","1981-11-13 14:17:22"
"185","61","97","1","Activity its clearly second real body painting notice beautiful three hospital simply next.","","2001-04-29 14:14:42","1989-11-05 18:37:58"
"186","17","36","2","Project who TV thank ahead while media cut prepare owner carry politics soon.","","2004-10-01 08:02:38","1998-12-09 17:32:23"
"187","80","96","5","Half second common join special PM authority parent mother agreement weight moment service instead thus kid.","","1981-05-29 19:47:15","1982-03-12 13:38:59"
"188","94","41","4","Conference future front break defense player yeah stop cold provide risk still feeling near imagine everybody.","","1971-07-20 18:50:23","2006-09-26 06:57:41"
"189","78","25","3","Human yeah few body each shoulder animal energy size set size.","","2009-01-28 01:38:35","1998-10-31 05:19:07"
"190","86","31","2","Guy suffer require be Democrat state physical career often reason than.","","2010-06-17 08:01:43","2005-11-19 07:27:27"
"191","19","46","2","Technology daughter last large apply exactly approach result dark stay will back continue school medical.","","2018-09-11 15:18:00","1972-04-21 04:06:01"
"192","93","6","5","Health certain back general drop century that interesting look second during forget not mean home.","","2015-08-03 11:09:02","1990-06-13 09:11:14"
"193","4","11","5","Role industry car outside wife manage same without senior simply story deep.","","2001-11-29 08:49:20","2013-11-24 07:47:30"
"194","51","50","2","Create subject by science claim seat many keep another fine that thousand condition.","","2017-06-01 06:06:08","1988-04-04 01:36:38"
"195","84","42","4","Heavy share sign difficult seat land character air baby concern trade five.","","1977-07-14 02:01:45","1984-01-26 17:27:47"
"196","15","1","4","Stay whom speak group fine set site popular can true.","","1986-07-16 11:30:27","2012-04-17 15:51:41"
"197","69","91","2","Drive opportunity pay political it similar bad purpose and matter subject follow.","","1972-07-08 14:35:41","1984-04-03 13:23:33"
"198","40","65","2","Position spring price market ready own skill and.","","1997-06-09 00:31:55","1999-07-16 07:50:14"
"199","33","14","5","Main like manager director pretty design century economy adult officer statement.","","1997-05-30 19:22:30","1977-02-01 11:31:23"
"200","99","40","5","Degree avoid but serious popular technology foot west then remain board action leg city century.","","2009-03-13 23:12:33","2016-02-10 19:17:24"
"201","59","8","3","Any ground participant culture gun direction sport reach production.","","2019-01-07 20:05:08","1996-07-02 12:45:28"
"202","80","90","3","Officer better fly couple begin treatment high significant by cover.","","1984-10-20 18:44:16","2010-01-24 17:29:31"
"203","10","0","5","Room manager newspaper type fill them sense fire down economic carry few such.","","1974-02-09 09:53:34","1997-04-01 09:45:25"
"204","7","52","3","Watch east religious standard cost trial property democratic set figure.","","1980-12-03 05:29:04","1993-07-15 01:58:00"
"205","14","60","3","Career way street ability management glass culture sing none effort.","","1987-11-17 06:07:10","2009-12-18 00:44:49"
"206","8","78","2","Spring stage road imagine everybody discussion someone business dark concern treat once enter skill.","","1989-09-30 15:18:28","1990-12-28 20:42:27"
"207","36","58","5","Issue central national relationship million father for conference east star.","","2008-08-10 07:32:45","1982-09-02 15:04:07"
"208","78","16","4","Experience try defense color wrong as American might loss citizen party.","","2005-03-13 05:13:21","1998-10-05 02:18:42"
"209","24","89","2","Anything something alone whatever full kid if.","","1973-01-24 17:37:48","1987-04-07 08:52:06"
"210","48","92","5","Off score fly manage seem provide west green arm I share rise call role sing as.","","1994-10-04 15:49:46","2018-12-23 21:36:09"
"211","93","56","4","Suggest laugh letter admit push boy middle author.","","1988-04-05 20:45:31","1971-01-16 20:03:47"
"212","68","70","1","Campaign technology phone writer shoulder culture style data suffer race event own.","","2012-05-09 08:50:08","1999-08-23 07:34:34"
"213","27","96","3","Local political professor begin seven simply sing everyone rather discuss culture see these individual consider.","","2000-05-29 11:40:36","1973-11-02 01:10:02"
"214","67","14","4","Toward right ability sort suffer describe standard his back wait every coach visit.","","1984-09-09 07:52:39","2015-07-09 04:29:02"
"215","56","89","4","Task as pressure training particular first real paper threat air process just cost.","","1970-11-13 01:16:44","1987-05-02 07:45:05"
"216","31","75","2","Center end race test health return artist shoulder six current reality especially.","","1993-04-28 18:14:19","1997-06-02 06:03:23"
"217","34","35","2","Production building certainly movement drug know surface minute writer discussion trade husband.","","2004-02-09 08:40:13","2015-08-30 22:42:16"
"218","24","28","3","Through firm center wait write meeting cell food other pattern cold quality.","","1978-05-31 00:50:25","2004-05-05 13:58:36"
"219","91","71","2","Per for last staff program western evening road end.","","1977-06-27 12:40:18","2024-02-21 02:56:30"
"220","65","49","5","Science campaign attack other cup discuss drug mission seven stay process myself practice worry result.","","1983-12-15 21:06:41","2013-08-07 17:42:09"
"221","67","100","1","Deep try trial thus recently enjoy skin own very forward whom.","","2019-08-28 18:40:34","2023-04-02 12:29:37"
"222","21","86","2","He despite entire nature perform sometimes office national cultural standard clear piece assume everybody marriage director.","","1987-10-15 18:38:37","2020-09-10 07:50:20"
"223","16","44","3","Yeah teach health put part between sea approach color look feeling treat team bed floor.","","1989-03-01 23:48:05","2017-08-18 13:22:58"
"224","49","54","1","Staff item president rest policy item few business drop physical painting hit along traditional guess attorney.","","1970-12-16 14:27:47","2017-02-05 19:59:59"
"225","81","89","1","His clearly film imagine take bank really field hospital generation just.","","1979-06-16 16:12:57","1989-09-09 04:09:26"
"226","67","56","1","Single attorney force quickly hot task his explain kind forward how decision.","","2017-10-04 14:46:01","2013-10-04 22:34:55"
"227","0","12","4","Fear become stop medical situation degree hit again pass tell.","","2008-12-28 09:37:23","1993-02-20 22:07:33"
"228","98","33","5","Step show serve cold station upon draw watch important.","","2001-02-10 10:45:17","2013-11-24 22:47:51"
"229","42","1","4","Difficult long black personal guy store just cell employee join.","","1976-11-19 00:28:41","2003-07-30 16:18:06"
"230","1","46","5","Those important allow loss Congress skill part whose perhaps since turn along mind.","","1989-06-21 21:25:53","2017-07-05 13:34:12"
"231","22","7","5","Executive not their region reach bit low compare stage trade watch many year year bank.","","2014-08-12 10:02:29","1974-01-18 07:27:05"
"232","56","83","4","Yet experience score goal list unit interesting year figure take radio both hear.","","2003-05-30 18:53:27","2020-03-18 07:13:23"
"233","37","26","1","Determine affect talk town finally board house month where fear summer.","","1979-01-23 18:29:06","2010-03-05 21:19:45"
"234","59","70","3","Attorney Republican office approach financial his blood understand manager bank clear pretty lawyer how mouth environmental.","","2004-01-29 20:03:28","2017-02-16 22:12:16"
"235","94","43","4","Reflect statement scene two without close skill.","","2011-03-02 18:31:22","1977-02-16 12:09:54"
"236","54","47","1","Ability surface move attack production we human customer bar environment.","","1999-10-17 15:04:39","1988-08-31 06:57:42"
"237","56","35","1","Former break four action glass policy similar similar crime father risk school management pick.","","2001-08-08 20:51:41","2012-12-17 21:56:40"
"238","13","19","3","Hair likely west light along into direction change thus.","","2016-03-11 19:42:20","2022-07-24 23:02:09"
"239","53","96","2","State Mr point down education available finally student daughter officer.","","1998-05-01 05:38:55","1996-05-02 12:37:11"
"240","67","84","1","By apply evidence above human across seat cold husband window we.","","1974-10-02 19:25:14","1988-11-26 13:24:06"
"241","36","71","2","Marriage director party century box artist including event either prepare none.","","1979-01-04 02:16:24","2002-02-15 03:07:00"
"242","17","2","1","Someone mouth major another set example check do theory commercial.","","1997-02-02 10:05:10","2000-05-13 14:37:38"
"243","98","42","2","National above sport degree keep such young model agreement open.","","1970-11-30 09:08:34","2024-08-08 00:52:19"
"244","87","18","5","Woman population painting large contain tax investment public safe image view cost drug truth true.","","2007-10-26 14:27:10","1993-03-11 06:55:14"
"245","24","72","3","List ability bar would police look choose art.","","1988-07-31 15:05:07","2024-01-12 03:11:13"
"246","37","20","3","Deep feeling piece agent month approach apply offer information thing.","","1970-02-05 06:06:55","1992-03-16 06:55:26"
"247","22","19","4","Draw clearly baby fall another environmental report discuss care represent most past whole marriage maybe room.","","1988-12-22 13:43:28","1973-06-06 18:58:19"
"248","65","52","4","Leader under experience officer while many system owner front attorney back partner artist get.","","2014-10-28 06:57:59","2005-08-11 05:47:25"
"249","35","46","5","Our coach brother value two another person almost.","","2008-11-05 06:23:36","2014-07-03 12:35:01"
"250","46","100","1","Few animal lose move threat capital past value upon serve.","","2006-07-12 21:19:18","2011-10-16 19:55:34"
"251","50","19","4","Eat go summer safe hit task enter event back capital four simply even magazine six.","","2005-08-30 16:04:24","2009-12-11 14:08:00"
"252","31","17","2","Small culture find ability would pattern explain real.","","1989-05-23 06:28:45","1980-09-11 06:59:40"
"253","52","63","5","Chance true group task peace least off performance in maybe.","","1982-12-03 21:01:10","2022-05-13 05:47:03"
"254","73","20","5","Political apply alone focus generation protect pass dark police laugh manager.","","2009-06-10 03:02:43","1973-07-16 22:16:06"
"255","41","57","3","Offer professor same past heavy specific make challenge yes.","","1989-04-23 03:22:22","2013-05-16 14:56:19"
"256","96","90","5","Place statement their around past continue above series level less happy organization draw mean if.","","2017-10-31 12:34:29","2004-06-03 19:36:27"
"257","24","4","5","Buy politics recent name television term player rate fear prevent leader training create speech stage want.","","1995-06-08 09:36:24","2005-02-13 19:01:55"
"258","48","95","5","Toward why today finish should move pattern relate should cause believe whose nothing dinner ask.","","1975-04-02 10:59:15","1988-10-03 11:12:37"
"259","37","79","3","Quite remain those miss six grow blue.","","2001-03-12 18:48:10","2001-02-26 00:25:57"
"260","17","50","5","Hard fly million fund parent notice thing see former never despite accept world school.","","2003-08-03 19:59:37","2001-06-14 13:48:26"
"261","46","6","5","Keep remain south environment tough explain common special station person worry.","","1988-12-23 23:09:35","2000-07-07 06:04:00"
"262","63","12","1","Party account range democratic gun easy trouble.","","1975-08-05 02:43:55","2020-07-16 18:59:16"
"263","36","68","3","Which together common office at certainly play event debate citizen.","","2023-08-08 11:15:27","1970-12-19 12:16:01"
"264","27","17","4","Sell between recently possible wish effort already continue glass event already challenge too science education situation.","","1985-03-12 02:01:39","1999-09-05 13:45:48"
"265","66","20","1","Strategy easy forget yard cut alone entire artist party return then prevent scientist region.","","2004-03-10 07:12:42","2003-10-06 18:25:23"
"266","63","51","2","Method treatment heart space woman soldier machine maybe himself Congress government benefit forward.","","1987-12-18 17:21:56","2022-03-16 22:25:37"
"267","32","86","1","Total price law entire trial nor court.","","2020-06-01 05:17:03","1970-05-03 18:41:50"
"268","62","51","1","Let ahead get word type quality quite baby too candidate mother trouble firm.","","2016-10-27 21:17:55","1997-01-22 23:59:03"
"269","21","26","1","Order music pressure peace term follow two allow member local itself.","","1973-02-09 00:59:59","2023-07-04 13:42:39"
"270","92","86","5","Audience ability once western another worry else artist listen get get good well green.","","2006-05-04 01:36:09","1979-03-19 07:49:44"
"271","52","55","4","City current action town they by modern entire whose successful yet church plan image father use.","","1983-02-14 18:12:11","1995-12-14 03:04:14"
"272","94","51","4","Subject help become lose fast front ready nature.","","2012-09-18 03:40:38","2003-11-14 20:27:40"
"273","93","23","3","White meeting method present stuff find help teacher move owner first system religious.","","2004-04-27 19:43:13","1993-10-31 22:05:50"
"274","30","50","5","Since politics entire provide service knowledge none why magazine.","","1999-12-24 02:26:23","1971-03-12 12:47:37"
"275","65","39","5","Control available begin level actually claim son smile check day industry.","","1972-12-25 16:34:16","1985-07-04 10:06:35"
"276","19","67","1","Poor then lawyer camera begin you improve.","","1970-03-08 07:16:21","2000-06-26 07:45:20"
"277","91","75","2","Perform own write involve around effect interview see receive material.","","2009-10-30 07:06:09","2003-07-05 12:35:07"
"278","99","12","3","Force generation power example ago current him item set.","","1977-04-06 22:24:30","2009-05-14 00:25:50"
"279","89","54","1","Note hear mother our use hand result task shoulder whose hear the.","","2018-02-10 17:02:45","2025-02-11 03:58:24"
"280","16","5","3","Research staff him design world shake campaign far concern why.","","1992-02-22 12:45:35","1973-04-28 20:22:20"
"281","42","86","2","Recent school side by suggest force hot someone stop hot at identify civil realize event.","","2017-03-22 14:35:48","1991-06-09 04:25:12"
"282","29","55","4","Read amount tough live green report measure lead several could.","","1970-09-18 23:29:31","1980-05-17 10:10:13"
"283","83","48","3","Early it beautiful up education each feel wide skill bank win two air.","","1989-06-30 22:02:57","2010-11-17 23:23:06"
"284","100","41","3","College spring vote prepare himself decide agency offer how.","","1999-03-11 17:11:23","1992-11-01 21:18:41"
"285","36","9","1","Girl reach world dog get condition together audience report long beyond including relationship.","","2020-12-31 06:25:08","2025-01-14 22:36:26"
"286","9","41","4","Director me store call one land television keep ability him maybe wish wonder attention.","","2018-07-19 07:31:24","2004-06-23 09:24:03"
"287","59","24","3","Man this class figure third position thank beyond likely maybe soldier financial there level.","","2007-10-21 12:01:39","1994-04-05 23:39:10"
"288","63","22","2","Note look your describe fund weight red leader that third suddenly wide compare discover.","","1996-10-31 17:26:04","2007-06-05 06:18:24"
"289","38","23","2","Expert material class full order develop evidence.","","1982-09-18 09:25:00","2008-10-14 09:14:52"
"290","73","44","5","Determine statement field firm work low marriage south understand.","","2002-05-27 21:47:03","2009-10-22 04:32:55"
"291","19","51","5","Wonder seat explain somebody defense worker director.","","2024-08-31 18:26:31","1999-02-24 01:15:52"
"292","57","20","4","Deal exist step reach radio beyond experience get.","","2014-12-18 07:46:50","1976-08-21 15:56:01"
"293","65","16","5","Anyone sense doctor them back alone build possible foot.","","2021-01-06 00:26:03","1980-04-08 10:39:04"
"294","61","63","4","Son shoulder shoulder him American home yes something shake by certainly.","","1981-09-13 00:57:25","2024-04-26 23:02:39"
"295","50","77","2","Necessary myself happen pressure fast practice maintain paper these country small newspaper.","","1971-02-27 03:14:45","1971-06-09 03:27:17"
"296","5","75","5","Way professor risk describe between heavy artist voice part without across ahead between teach decide.","","2020-01-06 07:10:38","1985-01-03 15:20:18"
"297","66","13","3","Police show call stand property friend paper anyone ground happen.","","2011-10-25 08:17:23","1987-03-26 05:27:25"
"298","50","35","2","Environmental win attention need because long indicate writer everyone level bill smile everybody travel up drop.","","1970-11-02 14:10:54","1998-06-05 17:44:52"
"299","34","6","1","Ok low gas send usually police strong.","","2015-12-06 15:06:00","2001-12-17 07:49:54"
"300","74","100","1","Property cell the citizen democratic still cost thing head view.","","1976-11-16 01:59:49","1998-03-20 16:13:10"
"301","18","100","2","Mr summer set all most friend wear way doctor can kitchen evidence.","","2002-07-08 01:21:20","2024-07-18 19:02:25"
"302","41","100","3","Market town community central stage which foreign attack give mother police sing truth.","","2014-01-05 06:59:38","2003-04-22 21:03:53"
"303","99","100","4","Total drive arm bad minute his production so he cost type air deal.","","2000-04-06 18:22:33","1989-01-13 12:16:07"
"304","75","100","2","Usually environmental exist many training than run instead.","","2007-04-22 17:27:15","1981-12-21 11:51:38"
"305","59","100","5","However material green radio she amount technology world.","","1979-11-23 22:46:52","1989-06-20 12:01:36"
"306","30","100","1","Responsibility mean pass life rise type design face worker population role imagine teacher standard none.","","2004-02-18 03:33:39","2012-01-04 14:19:59"
"307","48","100","1","Culture heart western born often I later sometimes.","","1982-04-29 14:39:18","1981-10-19 01:25:16"
"308","49","100","2","Blue share entire argue art inside laugh.","","2020-06-10 10:42:36","2012-04-11 13:02:54"
"309","100","100","5","Note but somebody wear possible north degree it song fight.","","2024-06-15 20:04:52","2000-10-21 17:27:13"
"310","60","100","4","Price rest seem community else nor what cold rise century well born human commercial by whether.","","2010-06-29 05:22:02","2015-03-24 20:20:57"
"311","64","100","5","Really such two reason right early success religious own view will compare author.","","1991-05-16 14:52:23","2011-11-03 00:25:16"
"312","38","100","5","Month water responsibility take girl oil weight a teacher PM step population tree community voice indicate.","","1998-07-26 16:45:04","1975-03-24 01:37:00"
"313","56","100","4","How answer attorney raise determine girl apply environment month form.","","1970-08-13 23:57:34","2020-09-05 11:39:53"
"314","85","100","4","Real form off style speech activity maybe decide interview science increase.","","2008-03-26 06:11:49","2023-06-28 15:14:43"
"315","15","100","5","Cold happen girl another experience improve strong PM pick she tend.","","1995-05-20 12:36:57","2014-02-17 15:22:11"
"316","12","100","3","Simply describe star project drive offer then property.","","1987-06-21 02:06:11","2009-11-22 07:42:36"
"317","65","100","3","Rise knowledge drug degree half easy single.","","2017-02-16 23:37:56","1982-09-18 22:43:01"
"318","100","73","5","Total staff so see success item race sound.","","2005-06-13 16:53:39","1983-04-10 20:16:36"
"319","100","26","3","Carry better give charge health allow admit who simply per.","","2000-06-27 21:39:39","2005-11-20 23:48:12"
"320","100","82","1","Blood senior information so first war who statement drop of work service modern understand.","","1987-11-26 13:52:08","2021-08-04 01:14:15"
"321","100","57","2","Form go create exactly group analysis hour significant could brother clearly share beautiful.","","2018-06-16 20:42:23","1976-09-25 12:03:43"
"322","100","31","2","Experience artist exist scene human white dark create kid southern particular national business type stock.","","2021-03-13 13:30:17","1976-10-28 03:18:16"
"323","100","54","2","Everyone anything sound yes phone us hotel.","","1982-06-23 01:34:31","2003-04-16 05:58:08"
"324","100","45","1","Large protect allow per continue customer half organization customer senior when factor.","","2010-02-16 04:39:48","2011-10-25 02:37:00"
"325","100","1","2","Include evening manage scientist miss leave second law risk let open.","","2012-01-28 04:42:42","2019-10-16 04:22:03"
"326","100","11","1","Allow when ten girl man save inside leave tonight own admit weight certain gas at food.","","1985-11-19 13:42:58","2006-11-04 21:21:04"
"327","100","70","5","Anyone choose simple again or moment official main laugh father four catch.","","1988-08-16 13:03:38","1993-12-02 16:31:31"
"328","100","33","4","Industry more quickly television citizen very run responsibility fight attorney.","","1976-12-15 00:12:41","1980-10-07 10:56:25"
"329","100","88","3","Side eight through page high Democrat go nearly office room increase.","","1992-04-14 15:54:04","2023-06-26 14:09:04"
"330","100","9","1","And despite follow pass coach as fund soldier put court first purpose couple trip foot five.","","1975-06-05 19:20:28","1995-06-08 21:03:04"
"331","100","99","1","Air environment town major hot glass future when end throughout capital start always.","","1973-05-19 05:16:34","1994-11-07 10:40:32"
"332","100","29","4","Actually population both still rise military lot improve experience Republican work.","","1998-09-26 21:49:34","2011-01-04 22:00:38"
"333","100","90","1","Campaign reality second compare finish something back often.","","1980-07-02 04:15:31","2019-04-17 07:47:02"
"334","100","44","5","Organization child stock bring thus between sort water reach box crime table speech score.","","2024-02-15 00:16:40","1972-06-08 02:07:57"
"335","100","67","5","Raise general discussion shake young car as west rich result to surface action meet.","","2017-04-25 22:05:44","1999-02-08 16:28:20"
